id,src,pmid,pmcid,doi,epmc_id,from,source,title,authorString,journalTitle,journalVolume,pubYear,journalIssn,pageInfo,pubType,isOpenAccess,inEPMC,inPMC,hasPDF,hasBook,hasSuppl,citedByCount,hasReferences,hasTextMinedTerms,hasDbCrossReferences,hasLabsLinks,hasTMAccessionNumbers,firstIndexDate,firstPublicationDate,issue,versionNumber,pub_type
641,epmc,NA,PMC2719003,NA,PMC2719003,search,PMC,"Abstracts for the Eighth Congress of the European Association for Neuro-Oncology (EANO) : September 12–14, 2008 Barcelona, Spain","Strik H, Buhk J, Bock C, Nitsche M, Hoffmann A, Wrede A, Marosi C, Kaiser U, Christmann M, Kaina B, Perry J, Mason W, Belanger K, Kavan P, Fulton D, Easaw J, Kirby S, Macdonald D, Shields C, Pouliot J, Ewelt C, Schroeteler J, Stummer W, Felsberg J, Steiger H, Sabel M, Brandes A, Tosoni A, Franceschi E, Mazza E, Santoro A, Faedi M, Labianca R, Bertorelle R, Perrone T, Pesenti E, Bello L, Castellano A, Bertani G, Gambini A, Casarotti A, Falini A, Stummer W, Pichlmeier U, Schackert G, Grauer O, Molling J, Sutmuller R, Nierkens S, Adema G, Lamszus K, Martens T, Laabs Y, Günther H, Witte L, Westphal M, Campos B, Wan F, Zeppernick F, Ahmadi R, Farhadi M, Roth W, Beckhove P, Unterberg A, Radlwimmer B, Herold-Mende C, Bello L, Verpelli C, Bertani G, Casaceli G, Lucini V, Galli R, Sala C, Bexell D, Gunnarsson S, Tormin A, Gisselsson D, Scheding S, Bengzon J, Thon N, Leske H, Schichor C, Tonn J, Goldbrunner R, Baiker A, Neyns B, Sadones J, Joosens E, Bouttens F, Verbeke L, Baurain J, Dhondt L, Strauven T, Chaskis C, Michotte A, Wick W, Puduvalli V, Chamberlain M, Carpentier A, Cher L, Mason W, Van den Bent M, Hong S, Thornton D, Fine H, Bogdahn U, Mahapatra A, Oliushine V, Mouli C, Parfenov V, Stockhammer G, Ludwig S, Wuerth G, Heinrichs H, Schlingensiepen K, Frappaz D, Dussart S, Pierga J, Bay J, Fabbro M, Djafari L, Sunyach M, Pfister S, Janzarik W, Remke M, Ernst A, Gnekow A, Reifenberger G, Scheurlen W, Omran H, Kulozik A, Lichter P, Trevisan E, Laguzzi E, Guarneri D, Bomprezzi C, Caroli M, Leoncini B, Soffietti R, Rudà R, Rees J, Winston J, Jager R, Benton C, Caseiras G, Tofts P, Altmann D, Tozer D, Waldman A, Rudà R, Laguzzi E, Pace A, Carapella C, Riva M, Salvati M, Silvani A, Fariselli L, Caroli M, Soffietti R, Kraemer D, Angelov L, Doolittle N, Siegal T, Peereboom D, Jahnke K, Shalom E, Barnett G, McGregor J, Neuwelt E, Omuro A, Taillandier L, Chinot O, Carnin C, Barrié M, Soussain C, Tanguy M, Sierra Del Rio M, Leblond V, Hoang-Xuan K, Pels H, Juergens A, Schirgens I, Glasmacher A, Schulz H, Engert A, Diehl V, Linnebank M, Schackert G, Reichmann H, Kroschinsky F, Vogt-Schaden M, Egerer G, Bode U, Deckert M, Fimmers R, Fliessbach K, Klockgether T, Schmidt-Wolf I, Schlegel U, Villà S, Miller R, Krengli M, Abusaris H, Baumert B, Servagi-Vernat S, Igdem S, Lucas A, Boluda S, Mirimanoff R, Dufour C, Micheli J, Fourcade A, Laplanche A, Kalifa C, Couanet D, Grill J, Woehrer A, Waldhoer T, Azizi A, Leisser I, Czech T, Budka H, Hainfellner J, Slavc I, Haberler C, W A, Demopoulos A, Napolitano B, Chalif D, Black K, van den Bent M, Stupp R, Hildebrand J, Brandes A, Mirimanoff R, Mason W, Weller M, Cairncross J, Delattre J, Lacombe D, Gorlia T, D’Abbiero N, Pisanello A, De Berti G, Iotti C, Palmieri T, Ramundo D, Galeandro M, Ruggieri M, Riccardi S, Lambertini D, Bizzocchi N, Ghadirpour R, Armaroli L, Marcello N, Frenay M, Simon J, Benboubker L, Taillandier L, Castera D, Campone M, Busson A, Berger F, Lebrun C, Butowski N, Lamborn K, Chang S, Page M, Parvataneni R, Chang S, Liepa A, Nicol S, Thornton D, Prados M, Weiler M, Hartmann C, Wiewrodt D, Herrlinger U, Bamberg M, von Deimling A, Weller M, Wick W, Glas M, Ley B, Leinhaas A, Eisenreich R, Steinfarz B, Schramm J, Simon M, Herrlinger U, Brüstle O, Scheffler B, Ruano Y, Ribalta T, Rodríguez de Lope A, Fiaño C, Pérez-Magán E, Hernández-Moneo J, Campos-Martín Y, García J, Mollejo M, Meléndez B, Dufour C, Cadusseau J, Varlet P, Auger N, Daudigeos E, Rodier P, Dias-Morais A, Vassal G, Chneiweiss H, Junier M, Sminia P, van Nifterik K, van den Berg J, Ameziane N, Hulsebos T, Leenstra S, Wedekind L, Lafleur M, Stalpers L, Slotman B, Beier D, Röhrl S, Pillai D, Schwarz S, Kunz-Schughart L, Proescholdt M, Brawanski A, Bogdahn U, Wischhusen J, Reifenberger G, Hau P, Beier C, Dorresteijn L, De Bruin M, van ’t Veer M, Noordijk E, van den Berg H, Aleman B, Kappelle A, Boogerd W, van Leeuwen F, Sherman J, Aregawi D, Lai A, Rosenfeld S, Fathallah-Shaykh H, Larner J, Newman S, Schiff D, Devriendt D, De Smedt F, David P, Massager N, Suki D, Patel A, Hatiboglu M, Abou-Assi H, Sawaya R, Peereboom D, Conlin A, Seidman A, Brewer C, Eroes C, Thon N, Grasbon-Frodl E, Poepperl G, Tonn J, Kreth F, Thon N, Erös C, Pöpperl G, Herms J, Tonn J, Kreth F, Henriksson R, Capala J, Michanek A, Lindahl S, Salford L, Franzén L, Blomquist E, Westlin J, Bergenheim T, Nonoguchi N, Kawabata S, Miyatake S, Iida K, Miyata S, Yokoyama K, Kuroiwa T, Kirihata M, Imahori Y, Ono K, Sabel M, Rapp M, Özcan Z, Fischer J, Rox J, Sorg R, Judy K, Lustig R, Lopinto J, Shen S, Fiveash J, Shan J, Park C, Lee S, Kim C, Kim D, Paek S, Kim D, Heo D, Kim I, Jung H, Mariani L, Andereggen L, Arnold M, Vajtai I, Vassella E, Spiegl-Kreinecker S, Pirker C, Filipits M, Lötsch D, Buchroithner J, Pichler J, Silye R, Micksche M, Fischer J, Berger W, Preusser M, Janzer R, Felsberg J, Reifenberger G, Stupp R, Gorlia T, Marosi C, Heinzl H, Hainfellner J, Hegi M, Aaberg-Jessen C, Christensen K, Schrøder H, Offenberg H, Brünner N, Kristensen B, Tortosa A, Bruna J, Roerig P, Martínez F, Riemenschneider M, Boluda S, Giménez-Bonafé P, Reifenberger G, Gehring K, Aaronson N, Sitskoorn M, Klein M, Postma T, van den Bent M, Beute G, Enting R, Kappelle A, Boogerd W, Veninga T, Twijnstra A, Boerman D, Taphoorn M, Elandt K, Kurz C, Hassler M, Dieckmann U, Rottenfusser A, Marosi C, Rooney A, Carson A, Whittle I, Erridge S, Grant R, Beltran S, El Rawas M, Sunyach M, Berlier P, Conter C, Borson-Chazot F, Frappaz D, Waagemans M, Dijkstra M, van Nieuwenhuizen D, Wumkes M, Dirven C, Reijneveld J, Klein M, Stalpers L, Taylor R, Boota N, Bujkiewicz S, Lucas J, Robinson K, Robson K, Saran F, Michalski A, Pizer B, Dufour C, Couanet D, Figarella-Branger D, Carrie C, Doz F, Sainte-Rose C, Raquin M, Laplanche A, Grill J, Kalifa C, Dragomir M, Gruber E, Anghel R, Rosca C, Ciurea A, Tascu I, Radu C, Ollero A, Marquez-Rivas J, Ramirez G, Quiroga E, Gimenez-Pando J, Segovia-Vergel C, Slavc I, Czech T, Gruber-Olipitz M, Peyrl A, Minichmayr E, Dietrich W, Juergens A, Pels H, Rogowski S, Schulz H, Reichmann H, Vogt-Schaden M, Schmidt-Wolf I, Schlegel U, Mut M, Oǧuz K, Ayhan S, Söylemezoǧlu F, Berker M, Laguzzi E, Rudà R, Trevisan E, Guarneri D, Pedersini R, Boccaletti R, Soffietti R, Taillandier L, Pallud J, Razak R, Barbarino-Monnier P, Baron M, Bauchet L, Bernier V, Capelle L, Carnin C, Fontaine D, Gatignol P, Guillet-May F, Leroy M, Mandonnet E, Peruzzi P, Duffau H, Herold-Mende C, Lemke B, Yousef M, Ahmadi R, Dictus C, Harting I, Hartmann C, Schnitzler P, Unterberg A, Michotte A, Chaskis C, Neyns B, Tyberghien A, Declerck M, Origer I, Sadones J, Veld P, Naydenov E, Tzekov C, Minkin K, Kalev O, Toncheva D, Mirchev N, Bussarsky V, Salvati M, Brogna C, d’Elia A, Melone A, Lenzi J, Frati A, Raco A, Santoro A, Giangaspero F, Delfini R, Fariselli L, Milanesi I, Possanzini M, Brait L, Bianchi L, Tzekov C, Naydenov E, Cherninkova S, Mirchev N, Minkin K, Enchev Y, Florian S, Abrudan C, Oslobanu A, Andrasoni Z, Pompili A, Giovannetti M, Telera S, Vidiri A, Occhipinti E, Pompili A, Caroli F, Cattani F, Giovannetti M, Raus L, Telera S, Vidiri A, Occhipinti E, Oikawa M, Ito T, Sato K, Maruyama T, Muragaki Y, Iseki H, Hori T, Nakamura H, Stummer W, Meinel T, Sabel M, Schackert G, Signorelli F, De Geronimo L, Guyotat J, Gallo P, Cecchi P, Ghimenton C, Schiavo N, Pinna G, Mazza C, Gerosa M, Turazzi S, Nakasu S, Nakasu Y, Fukami T, Jito J, Caroli M, Cardia A, Menghetti C, Borsa S, De Santis A, Fornari M, Gaini S, Kozler P, Benes V, Netuka D, Kramar F, Charvat F, Heesters M, Pruim J, Wester G, Bijl H, Bolt R, van Dijk J, Mooij J, Langendijk J, Glas M, Hundsberger T, Stuplich M, Wiewrodt D, Kurzwelly D, Nguyen-Huu B, Rasch K, Herrlinger U, Martinez Garcia M, Reynes G, Balaña C, Fernandez Chacon C, Benavides M, Perez Segura P, Herrero A, Garcia Velasco A, Perez Martin X, Gil Gil M, Pichler J, Buchroithner J, Nöbauer S, Wurm G, Wies W, Wimmer S, Trenkler J, Fischer J, Preusser M, Gelpi E, Rottenfusser A, Dieckmann K, Widhalm G, Dietrich W, Bertalanffy A, Prayer D, Hainfellner J, Marosi C, Dresemann G, Hosius C, Nikolova Z, Schleyer E, Wick A, Pascher C, Wick W, Weller M, Bogdahn U, Hau P, Dictus C, Chatziaslanidou D, Becker N, Lichter P, Herold-Mende C, Wirtz C, Unterberg A, Ahmadi R, Aoki T, Nojima K, Mizutani T, Takasu A, Milanesi I, De Santis M, Bergantin A, Fumagalli M, Bianchi L, Silvani A, Fariselli L, Miyatake S, Kawabata S, Nonoguchi N, Iida K, Miyata S, Yokoyama K, Kuroiwa T, Michiue H, Kirihata M, Ono K, Beldì D, Masini L, Loi G, Stecco A, Littera A, Carriero A, Krengli M, Schroeteler J, Rapp M, Ringelstein A, Stoffels G, Langen K, Stummer W, Steiger H, Ewelt C, Sabel M, Galeano I, Prat R, Lucas A, Martínez J, Martín M, Conde R, Amador R, Bataller L, Reynes G, Bertolini F, Bagni B, Valentini A, Depenni R, Cobelli M, Casolo A, Fontana A, Falasca A, Giacobazzi P, Pinna G, Pica A, Prior J, Maeder P, Paschoud M, Stupp R, Mirimanoff R, Delaloye A, Allenbach G, Coope D, Eggers C, Vollmar S, Heiss W, Herholz K, Payer F, Wurm W, Weiss S, Zechner B, Fazekas F, Miwa K, Takenaka S, Shinoda J, Matsuo M, Ueda T, Yokoyama K, Yamada J, Yano H, Iwama T, Rutten I, Baumert B, Withofs N, Hustinx R, Heesters M, van Dijk J, Pruim J, Bijl H, Bolt R, Groen R, Langendijk J, Mooij J, Monleon D, Morales J, Gonzalez-Darder J, Talamantes F, López-Ginés C, Celda B, Cerda-Nicolas M, Cuellar S, Morales J, Calvar J, Martinetto H, Celda B, Cerda-Nicolas M, Monleon D, Bienfait H, van den Brink W, Reynes G, Parada A, Martínez-Sales V, Vila V, Martín M, Reganon E, Galeano I, Prat R, Peris M, Cárdenas E, Kaloshi G, Martin-Duverneil N, Guillevin R, Laigle-Donadey F, Marie Y, Taillibert S, Mokhtari K, Hoang-Xuan K, Delattre J, Sanson M, Andersson U, Osterman P, Sjöström S, Johansen C, Henriksson R, Brännström T, Broholm H, Christensen H, Ahlbom A, Auvinen A, Feychting M, Lönn S, Kiuru A, Swerdlow A, Schoemaker M, Roos G, Malmer B, Schnell O, Krebs B, Beer A, Romagna A, Wagner E, Kretzschmar H, Tonn J, Goldbrunner R, Pérez-Magán E, Fiaño C, Ribalta T, García J, García-Claver A, Campos-Martín Y, Ruano Y, Hernández-Moneo J, Mollejo M, Meléndez B, Jaksch H, Bresgen N, Golaszewski S, Kleindienst W, Strasser P, Bordihn K, Al-Schameri R, Spiegl-Kreinecker S, Richling B, Ladurner G, Bello L, Verpelli C, Lucini V, Bertani G, Sala C, Yoshida Y, Nakada M, Harada T, Sugimoto N, Hayashi Y, Kita D, Uchiyama N, Hayashi Y, Hamada J, Gunnarsson S, Bexell D, Visse E, Salford L, Siesjö P, Bengzon J, Darabi A, Rebetz J, Tian D, Persson A, Widegren B, Salford L, Englund E, Gisselsson D, Fan X, Yoshida K, Kosaka H, Ichikawa T, kambara H, Inoue S, Maruo T, Kurozumi K, Nakamura K, Hamada H, Date I, Avril T, Gapihan G, Saikali S, Vauleon E, Hamlat A, Diabira S, Quillien V, Ogawa D, Okada Y, Okada M, Ohkubo S, Miyake K, Kanemura Y, Ito M, Tamiya T, Nagao S, Okano H, Corno D, Cipelletti B, Pala M, Politi L, Bulfone A, Galli R, van der Meulen A, Gao P, Kakkar V, Reijnhoudt J, Biber K, Boddeke H, Mooij J, Wibom C, Sandström M, Henriksson R, Johansson M, Antti H, Bergenheim T, Bleeker F, Lamba S, Zanon C, Troost D, Hulsebos T, Vandertop W, Leenstra S, Van Tilborg A, Bardelli A, Persson O, Brynnel U, Levander F, Widegren B, Krogh M, Salford L, Carrabba G, Agnithori S, Munoz D, Ehsani S, Mukhopadhyay D, Croul S, Guha A, Lavon I, Zrihan D, Cohen M, Reubinoff B, Einstein O, Ben-Hur T, Smith Y, Siegal T, Thon N, Leske H, Restle F, Grau S, Baiker A, Tonn J, Goldbrunner R, Avci C, Oktar N, Dalbasti T, Yilmaz S, Dodurga Y, Dogan Z, Numanoglu S, Akalin T, Gunduz C, Tabatabai G, Moehle R, Mittelbronn M, Weller M, Wick W, Gramatzki D, Weller M, Capper D, Mittelbronn M, Wick W, Tritschler I, Jones T, Johns C, Barnes J, Duntsch C, Sarissky M, Pilatova M, Perjesi P, Mojzis J, Sulla I, Cohen-Jonathan-Moyal E, Skuli N, Monferran S, Delmas C, Favre G, Bonnet J, Toulas C, Lefranc F, Mijatovic T, Kiss R, Alexandru O, Carapancea M, Fetea A, Dragutescu L, Castro J, Georgescu A, Backlund M, Dricu A, Tabatabaie P, Bergström P, Henriksson R, Bergenheim T, Santandreu F, Couce M, Brell M, Gene A, Oliver J, Roca P, Bruna J, González L, Miró J, Velasco R, Gil M, Tortosa A, Le Rhun E, Baranzelli M, Perret M, Dubois F, Bonneterre J, Hoffmann A, Buhk J, Nitsche M, Strik H, Takenaka S, Miwa K, Shinoda J, Matsuo M, Ueda T, Yokoyama K, Yamada J, Yano H, Iwama T, Devriendt D, De Smedt F, David P, Massager N, Salvati M, Brogna C, D‘elia A, Melone A, Lenzi J, Bastianello S, Raco A, Santoro A, Giangaspero F, Delfini R, Muñoz S, Cuadrado V, Arruga J, Castillo L, Prat R, Galeano I, Todolí J, Amador R, Bataller L, Martín M, Reynes G, Happold C, Ernemann U, Roth P, Wick W, Weller M, Schmidt F, Ros T, Rebersek M, Boc M, Ocvirk J, Jereb S, Groselj L, Knific J, Graus F, Saiz A, Lai M, Bruna J, López F, Sabater L, Blanco Y, Rey M, Ribalta T, Dalmau J, Cordera S, Bottacchi E, Alvaro M, Joossens E, Neyns B, Mrugala M, Johnston S, Chamberlain M, San J, Rockhill J, Haug J, Spence A, Hilverda K, Heimans J, Bosma I, Postma T, Vandertop P, Slotman B, Reijneveld J, Klein M, Bellver-Pérez A, Muntaner G, Tort B, Ureste M, Salcedo J, Heese O, Schmidt M, Nickel S, Westphal M, Dijkstra M, van Nieuwenhuizen D, Stalpers L, Waagemans M, Vandertop W, Heimans J, Leenstra S, Dirven C, Reijneveld J, Klein M, Pamucka M, Czopkiewicz L, Jawien̓ W, Kosniewski W, Tokar P, Polednia-Jabłon̓ska K, Detert N, Blesing C, Warner N, Russell V, Matijasevic M, Arsenijevic J, Milosevic S, Ždrale Z, Tomasevic Z, Spetz A, Henriksson R, Salander P, La Rocca R, Vitaz T, Villanueva W, Hodes J, Cervera A, New P, Litofsky N, Litofsky N, Salvati M, Brogna C, d‘Elia A, Melone A, Lenzi J, Frati A, Rojas M, Santoro A, Giangaspero F, Delfini R, Goeppert M, Felsberg J, Stummer W, Reifenberger G, Steiger H, Sabel M, Bock H, Hinz J, Kantelhardt S, Rohde V, Giese A, Caroli M, Campanella R, Menghetti C, Zella S, Borsa S, Costa F, De Santis A, Fornari M, Gaini S, Beauchesne P, Carnin C, Bernier V, Taillandier L, Grimm S, Marymont M, Chandler J, Muro K, Newman S, Levy R, Rice L, Burns K, Cabreza C, Raizer J, Weber F, Floeth F, Asher A, Westphal M, Merchant N, Harutyunyan L, Galstyan H, Matosyan V, Jamakochyan G, Cordier D, Forrer F, Kneifel S, Müller-Brand J, Mäcke H, Merlo A, Okada M, Hatakeyama T, Ogawa D, Ookubo S, Miyake K, Kawai N, Tamiya T, Yamamoto Y, Nishiyama Y, Widhalm G, Wolfsberger S, Preusser M, Wöhrer A, Kotter M, Czech T, Marosi C, Knosp E, Garcia M, Tortosa A, Maldonado X, Gonzalez S, Balaña C, Gallego O, Verger E, Fuentes R, Navarro V, Gil M, Nakasu Y, Mitsuya K, Horiguchi S, Watanabe R, Nakasu S, Sanz C, Ramirez J, Ruiz-Xivillé N, Carrato C, Granada I, Millá F, Ariza A, Villá S, Rosell R, Balaña C, Mellai M, Chiò A, Lanotte M, Cassoni P, Caldera V, Annovazzi L, Finocchiaro G, Schiffer D, Wemmert S, Ketter R, Bettscheider M, Alt S, Kammers K, Rahnenführer J, Steudel W, Urbschat S, Sadones J, Michotte A, Veld P, Chaskis C, Menten J, Joosens E, Strauven T, Califice S, De Greve J, Neyns B, Lee C, Kim M, Kang Y, Joo M, Park S, Fontaine D, Vandenbos F, Lebrun C, Paquis V, Frenay M, Ferrer-Luna R, Martinetto H, Mata M, Nuñez L, Arias E, Dasi F, Calvar J, Piquer J, Sevlever G, Celda B, Hülper P, Kugler W, Lakomek M, Erdlenbruch B, Hong Y, Kim C, Chung D, Jung C, Kim T, Salford L, Persson O, Carlsson A, Widegren B, Siesjö P, Skagerberg G, Ingvarsson J, Wingren C, Borrebaeck C, Ketter R, Rahnenführer J, Henn W, Feiden W, Steudel W, Wemmert S, Urbschat S, Mata M, López-Ginés C, Gil-Benso R, Cortes O, Gonzalez-Darder J, Celda B, Cerdá-Nicolás M, Miwa T, Hirose Y, Sasaki H, Yoshida K, Kawase T, López-Ginés C, Faus C, Gil-Benso R, Monleon D, Mata M, Morales J, Leon J, Gonzalez-Darder J, Celda B, Cerdá-Nicolás M, Martinez R, Basten O, Ropero S, Hofmann E, Giese A, Behr R, Esteller M, Celda B, Monleon D, Piquer J, Llacer J, Revert A, Molla E, Martinez-Bisbal M, Entz-Werle N, Guerin E, Legrain M, Neuville A, Maitrot D, Lutz P, Kehrli P, Gaub M, Bauchet L, Rigau V, Mathieu-Daudé H, Branger D, Fabbro P, Taillandier L, Marcos-Gragera R, Raspall R, Vilardell L, Barraza G, Joly C, Garcia-Gil M, Lee H, Gilbert A, MacArthur R, Fabbro M, Maran A, Rigau V, Bauchet L, Duffau H, Peray P, Costes V, Erridge S, Kerr G, Hart M, McNamara S, Smith C, Grant R, Whittle I, Gregor A, de Campos J, Kusak M, Klein C, Ayerbe J, del Villar A, Sarasa J, de Campos J, Kusak M, Vallejo L, Sarasa J, del Villar A, Menei P, Metellus P, Loiseau H, Capelle L, Jacquet G, Guyotat J, Salvati M, Brogna C, d‘Elia A, Melone A, Lenzi J, Frati A, Santoro A, Esposito V, Giangaspero F, Delfini R, Salvati M, Brogna C, Melone A, D‘elia A, Donato V, Esposito V, Santoro A, Giangaspero F, Delfini R, Cantore G, Dresemann G, Sorenson G, Reardon D, Hosius C, Parker R, Nikolova Z, Molina-Garrido M, Guillen-Ponce C, Guirado-Risueño M, Mora A, Molina M, Molina M, Carrato A, Molnár P, Barla S, Nagy D, Nagy G, Berényi E, Dobai J, Linhares P, Martinho O, Lopes J, Vaz R, Reis R, Hwang J, Sohn Y, Hwang S, Martinez R, Hofmann E, Behr R, Basten O, Ropero S, Esteller M, Lefranc F, Ingrassia L, Van Quaquebeke E, Darro F, Kiss R, Onishi M, Ichikawa T, Inoue S, Maruo T, Kosaka H, Yoshida K, Kurozumi K, Kambara H, Chiocca E, Date I, Lefranc F, Spiegl-Kreinecker S, Haibe-Kains B, Bontempi G, Decaestecker C, Berger W, Kiss R, Oellers P, Senner V, Paulus W, Thanos S, Maruo T, Ichikawa T, Kanzaki H, Onishi M, Inoue S, Yoshida K, Kambara H, Ouchida M, Shimizu K, Date I, Jung S, Ryu H, Pei J, Jin S, Jung T, Moon K, Kim I, Kang S, Kugler W, Hülper P, Lakomek M, Gavish M, Veenman L, Short S, Martindale C, Worku M, Bourne S, Roth P, Schmidt F, Herrmann C, Kissel M, Leban J, Weller M, Kanno H, Kobayashi N, Yoshida T, Lefranc F, Mijatovic T, De Neve N, Gaussin J, Van Quaquebeke E, Van Vynckt F, Darro F, Kiss R, Mardor Y, Last D, Merchant N, Denmeade S, Daniels D, Ram Z, Chen H, Kwan A, Chen Z, Allerstorfer S, Pirker C, Spiegl-Kreinecker S, Pichler J, Buchroithner J, Grusch M, Silye R, Fischer J, Micksche M, Berger W, Toering S, Boer K, Heimans J, Aronica E, Reijneveld J, Niclou S, Danzeisen C, Brons N, Eikesdal H, Enger P, Bjerkvig R, Patil S, Burzynski S, Chittur S, Mrowczynski E, Grela K, Valle-Argos B, Gómez-Nicola D, Nieto-Sampedro M, Inda M, Bonavia R, Tan P, Hadwiger P, Mukasa A, Narita Y, Sah D, Furnari F, Cavenee W, Schichor C, von Luettichau I, Krebs B, Grau S, Herms J, Tonn J, Nelson P, Goldbrunner R.",Neuro Oncol,10,2008,1522-8517; 1523-5866;,1061-1149,meeting-report; meeting report,N,Y,Y,Y,N,N,0,N,Y,N,N,N,2010-05-17,2008-12-01,6,NA,meeting
642,epmc,29919626,PMC5106655,NA,29919626,search,MED,"Quarterly Periscope of Practical Medicine; Being <i>the Spirit of the Medical Journals</i>, Foreign and Domestic.",NA,Med Chir Rev,5,1826,NA,486-544,other; journal article,Y,Y,N,Y,N,N,0,N,N,N,N,N,2018-06-20,1826-10-01,10,NA,journal article
643,epmc,NA,PMC7163982,NA,PMC7163982,search,PMC,Poster Presentations,NA,FEBS J,275,2008,1742-464x; 1742-4658;,99-437,abstract,Y,Y,Y,Y,N,N,0,N,N,N,N,N,2020-04-19,2008-06-01,suppl 1,NA,abstract
646,epmc|pm,36070867,NA,10.1093/bib/bbac388,36070867,search,MED,A machine learning framework based on multi-source feature fusion for circRNA-disease association prediction.,"Wang L, Wong L, Li Z, Huang Y, Su X, Zhao B, You Z.",Brief Bioinform,23,2022,1467-5463; 1477-4054;,bbac388,"research support, non-u.s. gov't; journal article",N,N,N,N,N,N,0,N,Y,N,N,N,2022-09-09,2022-09-01,5,NA,journal article
647,epmc,NA,NA,10.21203/rs.3.rs-1804453/v1,PPR516595,search,PPR,A novel N7-methylguanosine(m7G) methylation-associated miRNA signature for prognostic value in patient with carcinoma of colon,"Wang C, Liu S.",NA,NA,2022,NA,NA,preprint,N,N,N,N,N,N,0,N,Y,N,Y,N,2022-07-12,2022-07-11,NA,NA,preprint
651,epmc|pm,36018415,NA,10.1007/s11033-022-07874-4,36018415,search,MED,MAP kinase and mammalian target of rapamycin are main pathways of gallbladder carcinogenesis: results from bioinformatic analysis of next generation sequencing data from a hospital-based cohort (NCT05404347).,"Rajput M, Chigurupati S, Purwar R, Shukla M, Pandey M.",Mol Biol Rep,NA,2022,0301-4851; 1573-4978;,NA,journal article,N,N,N,N,N,N,0,Y,Y,N,Y,N,2022-08-27,2022-08-26,NA,NA,journal article
652,epmc|pm,36082523,PMC9533252,10.1302/2046-3758.119.bjr-2022-0075.r1,36082523,search,MED,ATF3 as a potential diagnostic marker of early-stage osteoarthritis and its correlation with immune infiltration through bioinformatics analysis.,"Yang J, Fan Y, Liu S.",Bone Joint Res,11,2022,2046-3758,679-689,journal article,N,N,N,N,N,N,0,N,Y,N,Y,N,2022-09-10,2022-09-01,9,NA,journal article
654,epmc|pmc|pm,35928610,PMC9344404,10.21037/jtd-22-632,35928610,search,MED,Identification of hub genes and their correlation with immune infiltration in coronary artery disease through bioinformatics and machine learning methods.,"Huang KK, Zheng HL, Li S, Zeng ZY.",J Thorac Dis,14,2022,2072-1439; 2077-6624;,2621-2634,research-article; journal article,Y,Y,N,Y,N,Y,0,Y,Y,N,Y,N,2022-08-06,2022-07-01,7,NA,journal article
655,epmc|pmc|pm,35754819,PMC9214213,10.3389/fgene.2022.907754,35754819,search,MED,Risk Model and Immune Signature of m7G-Related lncRNA Based on Lung Adenocarcinoma.,"Zhang C, Zhou D, Wang Z, Ju Z, He J, Zhao G, Wang R.",Front Genet,13,2022,1664-8021,907754,research-article; journal article,Y,Y,N,Y,N,N,0,Y,Y,N,Y,N,2022-06-28,2022-06-08,NA,NA,journal article
657,epmc,NA,NA,10.1101/2022.05.27.493696,PPR499501,search,PPR,"OntoContext, a new python package for gene contextualization based on the annotation of biomedical texts","Bedhiafi W, Thomas-Vaslin V, Benammar Elgaaied A, Six A.",NA,NA,2022,NA,NA,preprint,N,N,N,N,N,N,0,N,Y,N,Y,N,2022-05-31,2022-05-28,NA,NA,preprint
659,epmc|pmc,36229514,PMC9561152,10.1038/s41598-022-21525-5,36229514,search,MED,Pax3 loss of function delays tumour progression in kRAS-induced zebrafish rhabdomyosarcoma models.,"Kahsay A, Rodriguez-Marquez E, López-Pérez A, Hörnblad A, von Hofsten J.",Sci Rep,12,2022,2045-2322,17149,research-article; journal article,Y,Y,N,Y,N,Y,0,Y,Y,N,Y,N,2022-10-14,2022-10-13,1,NA,journal article
660,epmc|pmc,35927660,PMC9354352,10.1186/s12890-022-02095-8,35927660,search,MED,The clinical significance of integrin subunit alpha V in cancers: from small cell lung carcinoma to pan-cancer.,"Tang YL, Li GS, Li DM, Tang D, Huang JZ, Feng H, He RQ, Huang ZG, Dang YW, Kong JL, Gan TQ, Zhou HF, Zeng JJ, Chen G.",BMC Pulm Med,22,2022,1471-2466,300,research-article; journal article,Y,Y,N,Y,N,Y,0,Y,Y,N,Y,N,2022-08-06,2022-08-04,1,NA,journal article
661,epmc,NA,NA,10.21203/rs.3.rs-1559305/v1,PPR483920,search,PPR,A Message Passing framework with Multiple data integration for miRNA-Disease association prediction,"Dong TN, Schrader J, Mücke S, Khosla M.",NA,NA,2022,NA,NA,preprint,N,N,N,N,N,N,0,N,Y,N,Y,N,2022-04-21,2022-04-18,NA,NA,preprint
662,epmc|pm,35834966,NA,10.1016/j.compbiomed.2022.105832,35834966,search,MED,Capturing the latent space of an Autoencoder for multi-omics integration and cancer subtyping.,"Madhumita, Paul S.",Comput Biol Med,148,2022,0010-4825; 1879-0534;,105832,"research support, non-u.s. gov't; journal article",N,N,N,N,N,N,0,N,Y,N,Y,N,2022-07-15,2022-07-05,NA,NA,journal article
665,epmc,NA,NA,10.21203/rs.3.rs-1209284/v2,PPR473130,search,PPR,Comprehensive bioinformatic analysis of the expression and prognostic significance of TSC22D domain family genes in acute myeloid leukemia,"Xu X, Jin X, Wang J, Sun R, Zhang M, Xiong X, Xie D, Zhao M.",NA,NA,2022,NA,NA,preprint,N,N,N,N,N,N,0,N,Y,N,N,N,2022-03-29,2022-03-28,NA,2,preprint
667,epmc|pmc|pm,34275487,PMC8286442,10.1186/s13326-021-00245-1,34275487,search,MED,The Infectious Disease Ontology in the age of COVID-19.,"Babcock S, Beverley J, Cowell LG, Smith B.",J Biomed Semantics,12,2021,2041-1480,13,"research-article; journal article; research support, n.i.h., extramural",Y,Y,N,Y,N,Y,3,Y,Y,N,Y,N,2021-07-20,2021-07-18,1,NA,journal article
668,epmc|pmc,35561164,PMC9113354,10.1093/bioinformatics/btac175,35561164,search,MED,CBNplot: Bayesian network plots for enrichment analysis.,"Sato N, Tamada Y, Yu G, Okuno Y.",Bioinformatics,38,2022,1367-4803; 1367-4811;,2959-2960,"brief-report; research support, non-u.s. gov't; journal article",Y,Y,N,Y,N,Y,0,Y,Y,N,N,Y,2022-05-15,2022-05-01,10,NA,journal article
669,epmc|pmc,35579551,PMC9112763,10.1093/gigascience/giac047,35579551,search,MED,A decade of GigaScience: 10 years of the evolving genomic and biomedical standards landscape.,Schriml LM.,Gigascience,11,2022,2047-217x,giac047,research-article; journal article,Y,Y,N,Y,N,N,0,Y,N,N,Y,N,2022-05-18,2022-05-01,NA,NA,journal article
672,epmc|pmc|pm,36248192,PMC9553458,10.1155/2022/1878766,36248192,search,MED,FAM171B as a Novel Biomarker Mediates Tissue Immune Microenvironment in Pulmonary Arterial Hypertension.,"Qu LH, Luo WJ, Yan ZG, Liu WP.",Mediators Inflamm,2022,2022,0962-9351; 1466-1861;,1878766,research-article; journal article,Y,Y,N,Y,N,Y,0,Y,Y,N,Y,N,2022-10-18,2022-09-22,NA,NA,journal article
674,epmc|pm,35622496,NA,10.1099/jmm.0.001538,35622496,search,MED,Network pharmacology and experimental validation identify the potential mechanism of sophocarpine for COVID-19.,"Zhang HX, Zhang X.",J Med Microbiol,71,2022,0022-2615; 1473-5644;,NA,journal article,N,N,N,N,N,N,0,N,Y,N,N,N,2022-05-28,2022-05-01,5,NA,journal article
