id,src,pmid,pmcid,doi,epmc_id,from,source,title,authorString,journalTitle,journalVolume,pubYear,journalIssn,pageInfo,pubType,isOpenAccess,inEPMC,inPMC,hasPDF,hasBook,hasSuppl,citedByCount,hasReferences,hasTextMinedTerms,hasDbCrossReferences,hasLabsLinks,hasTMAccessionNumbers,firstIndexDate,firstPublicationDate,issue,versionNumber,pub_type
1267,epmc|pmc,34697542,PMC8541878,10.1155/2021/5680968,34697542,search,MED,High Expression Levels of SLC38A1 Are Correlated with Poor Prognosis and Defective Immune Infiltration in Hepatocellular Carcinoma.,"Liu Y, Yang Y, Jiang L, Xu H, Wei J.",J Oncol,2021,2021,1687-8450; 1687-8469;,5680968,research-article; journal article,Y,Y,N,Y,N,Y,0,Y,Y,N,Y,N,2021-11-25,2021-10-16,NA,NA,journal article
1268,epmc|pmc,28753379,PMC5620671,10.1164/rccm.201706-1248le,28753379,search,MED,Gene Expression Signatures in Tuberculosis Have Greater Overlap with Autoimmune Diseases Than with Infectious Diseases.,"Clayton K, Polak ME, Woelk CH, Elkington P.",Am J Respir Crit Care Med,196,2017,1073-449x; 1535-4970;,655-656,"letter; comparative study; research support, non-u.s. gov't",N,Y,N,Y,N,N,10,Y,Y,N,Y,Y,2017-07-31,2017-09-01,5,NA,other
1270,epmc|pmc,34153524,PMC8446800,10.1016/j.jcmgh.2021.06.006,34153524,search,MED,Secretory Sorcery: Paneth Cell Control of Intestinal Repair and Homeostasis.,"Cray P, Sheahan BJ, Dekaney CM.",Cell Mol Gastroenterol Hepatol,12,2021,2352-345x,1239-1250,"research support, non-u.s. gov't; review-article; review; journal article; research support, n.i.h., extramural",Y,Y,N,Y,N,N,3,Y,Y,N,Y,N,2021-06-22,2021-06-18,4,NA,journal article
1272,epmc|pmc,34344385,PMC8329642,10.1186/s12911-021-01593-9,34344385,search,MED,COVID term: a bilingual terminology for COVID-19.,"Ma H, Shen L, Sun H, Xu Z, Hou L, Wu S, Fang A, Li J, Qian Q.",BMC Med Inform Decis Mak,21,2021,1472-6947,231,"research support, non-u.s. gov't; research-article; journal article",Y,Y,N,Y,N,N,0,Y,Y,N,Y,N,2021-08-05,2021-08-03,1,NA,journal article
1274,epmc|pmc,35801930,PMC9438961,10.1093/bioinformatics/btac492,35801930,search,MED,Needle: A fast and space-efficient prefilter for estimating the quantification of very large collections of expression experiments.,"Darvish M, Seiler E, Mehringer S, Rahn R, Reinert K.",Bioinformatics,NA,2022,1367-4803; 1367-4811;,btac492,research-article; journal article,Y,Y,N,Y,N,Y,0,Y,N,N,Y,N,2022-07-09,2022-07-08,NA,NA,journal article
1276,epmc|pmc,34367171,PMC8346206,10.3389/fimmu.2021.709466,34367171,search,MED,Human Placental Trophoblasts Infected by <i>Listeria monocytogenes</i> Undergo a Pro-Inflammatory Switch Associated With Poor Pregnancy Outcomes.,"Johnson LJ, Azari S, Webb A, Zhang X, Gavrilin MA, Marshall JM, Rood K, Seveau S.",Front Immunol,12,2021,1664-3224,709466,"research-article; journal article; research support, n.i.h., extramural",Y,Y,N,Y,N,Y,2,Y,Y,Y,Y,Y,2021-08-10,2021-07-23,NA,NA,journal article
1278,epmc|pmc,34692538,PMC8526889,10.3389/fonc.2021.753910,34692538,search,MED,Mechanical Stimulus-Related Risk Signature Plays a Key Role in the Prognostic Nomogram For Endometrial Cancer.,"Xu X, Li X, Zhou J, Wang J.",Front Oncol,11,2021,2234-943x,753910,research-article; journal article,Y,Y,N,Y,N,N,0,Y,Y,N,Y,N,2021-11-24,2021-10-06,NA,NA,journal article
1279,epmc|pmc,35100366,PMC9209812,10.1093/genetics/iyab222,35100366,search,MED,Fission stories: using PomBase to understand Schizosaccharomyces pombe biology.,"Harris MA, Rutherford KM, Hayles J, Lock A, Bähler J, Oliver SG, Mata J, Wood V.",Genetics,220,2022,0016-6731; 1943-2631;,iyab222,"research support, non-u.s. gov't; research-article; journal article",Y,Y,N,Y,N,N,0,Y,Y,N,Y,N,2022-02-03,2022-04-01,4,NA,journal article
1284,epmc|pmc,35412634,PMC9262594,10.1093/nar/gkac215,35412634,search,MED,EPIMUTESTR: a nearest neighbor machine learning approach to predict cancer driver genes from the evolutionary action of coding variants.,"Parvandeh S, Donehower LA, Panagiotis K, Hsu TK, Asmussen JK, Lee K, Lichtarge O.",Nucleic Acids Res,50,2022,0305-1048; 1362-4962;,e70,"research support, non-u.s. gov't; research-article; research support, u.s. gov't, non-p.h.s.; journal article; research support, n.i.h., extramural",Y,Y,N,Y,N,Y,1,Y,Y,N,Y,N,2022-04-13,2022-07-01,12,NA,journal article
1286,epmc|pmc,34356520,PMC8301326,10.3390/biology10070665,34356520,search,MED,FLAME: A Web Tool for Functional and Literature Enrichment Analysis of Multiple Gene Lists.,"Thanati F, Karatzas E, Baltoumas FA, Stravopodis DJ, Eliopoulos AG, Pavlopoulos GA.",Biology (Basel),10,2021,2079-7737,665,research-article; journal article,Y,Y,N,Y,N,Y,3,Y,Y,N,Y,N,2021-08-07,2021-07-14,7,NA,journal article
1287,epmc|pm,26394433,NA,10.1109/tcbb.2015.2480056,26394433,search,MED,A Framework for Identifying Genotypic Information from Clinical Records: Exploiting Integrated Ontology Structures to Transfer Annotations between ICD Codes and Gene Ontologies.,"Hashemikhabir S, Xia R, Xiang Y, Janga SC.",IEEE/ACM Trans Comput Biol Bioinform,15,2018,1545-5963; 1557-9964;,1259-1269,"research support, non-u.s. gov't; journal article",N,N,N,N,N,N,0,N,Y,N,N,N,2015-09-23,2015-09-18,4,NA,journal article
1288,epmc|pm,23920598,NA,NA,23920598,search,MED,Design of schistosomiasis ontology (IDOSCHISTO) extending the infectious disease ontology.,"Camara G, Despres S, Djedidi R, Lo M.",Stud Health Technol Inform,192,2013,0926-9630; 1879-8365;,466-470,journal article,N,N,N,N,N,N,1,N,Y,N,N,N,2013-08-07,2013-01-01,NA,NA,journal article
1289,epmc|pmc,NA,PMC9278315,10.1093/database/baac027,PMC9278315,search,PMC,Conference report: Biocuration 2021 Virtual Conference,"Quaglia F, Balakrishnan R, Bello S, Vasilevsky N.",Database: The Journal of Biological Databases and Curation,2022,2022,1758-0463,NA,meeting-report; meeting report,Y,Y,Y,Y,N,N,0,N,Y,N,N,N,2022-09-16,2022-01-01,NA,NA,meeting
1290,epmc|pmc,35682796,PMC9181295,10.3390/ijms23116118,35682796,search,MED,The Emerging Roles of Long Non-Coding RNAs in Intellectual Disability and Related Neurodevelopmental Disorders.,"Liaci C, Prandi L, Pavinato L, Brusco A, Maldotti M, Molineris I, Oliviero S, Merlo GR.",Int J Mol Sci,23,2022,1422-0067,6118,review-article; review; journal article,Y,Y,N,Y,N,N,0,Y,Y,N,Y,N,2022-06-11,2022-05-30,11,NA,journal article
1291,epmc|pmc,30622555,PMC6308971,10.3389/fgene.2018.00661,30622555,search,MED,Introducing WikiPathways as a Data-Source to Support Adverse Outcome Pathways for Regulatory Risk Assessment of Chemicals and Nanomaterials.,"Martens M, Verbruggen T, Nymark P, Grafström R, Burgoon LD, Aladjov H, Torres Andón F, Evelo CT, Willighagen EL.",Front Genet,9,2018,1664-8021,661,research-article; journal article,Y,Y,N,Y,N,N,9,Y,Y,N,Y,N,2019-01-10,2018-12-21,NA,NA,journal article
1293,epmc|pmc,36052758,PMC9577957,10.1111/acel.13696,36052758,search,MED,Umbilical cord plasma concentrate has beneficial effects on DNA methylation GrimAge and human clinical biomarkers.,"Clement J, Yan Q, Agrawal M, Coronado RE, Sturges JA, Horvath M, Lu AT, Brooke RT, Horvath S.",Aging Cell,21,2022,1474-9718; 1474-9726;,e13696,research-article; journal article,Y,Y,N,Y,N,Y,0,Y,Y,N,Y,N,2022-09-03,2022-09-02,10,NA,journal article
1294,epmc|pmc,31147718,PMC6602476,10.1093/nar/gkz479,31147718,search,MED,RNAmod: an integrated system for the annotation of mRNA modifications.,"Liu Q, Gregory RI.",Nucleic Acids Res,47,2019,0305-1048; 1362-4962;,W548-W555,"research-article; journal article; research support, n.i.h., extramural",Y,Y,N,Y,N,Y,28,Y,Y,N,Y,N,2019-06-01,2019-07-01,w1,NA,journal article
1296,epmc|pmc,33742785,PMC8504839,10.1111/cts.13021,33742785,search,MED,Application of MCAT questions as a testing tool and evaluation metric for knowledge graph-based reasoning systems.,"Fecho K, Balhoff J, Bizon C, Byrd WE, Hang S, Koslicki D, Rensi SE, Schmitt PL, Wawer MJ, Williams M, Ahalt SC.",Clin Transl Sci,14,2021,1752-8054; 1752-8062;,1719-1724,"research support, n.i.h., intramural; brief-report; evaluation study; journal article",Y,Y,N,Y,N,Y,0,Y,Y,N,Y,N,2021-03-21,2021-04-09,5,NA,journal article
1299,epmc|pmc,35635086,PMC9275865,10.1080/21655979.2022.2081457,35635086,search,MED,FAM83A antisense RNA 1 (<i>FAM83A-AS1</i>) silencing impairs cell proliferation and induces autophagy via MET-AMPKɑ signaling in lung adenocarcinoma.,"Zhao H, Wang Y, Wu X, Zeng X, Lin B, Hu S, Zhang S, Li Y, Zhou Z, Zhou Y, Du C, Beer DG, Bai S, Chen G.",Bioengineered,13,2022,2165-5979; 2165-5987;,13312-13327,research-article; journal article,Y,Y,N,Y,N,Y,0,Y,Y,Y,Y,N,2022-06-01,2022-05-01,5,NA,journal article
1301,epmc|pmc,33590873,PMC7937031,10.1093/database/baab004,33590873,search,MED,Converting disease maps into heavyweight ontologies: general methodology and application to Alzheimer's disease.,"Henry V, Moszer I, Dameron O, Vila Xicota L, Dubois B, Potier MC, Hofmann-Apitius M, Colliot O, INSIGHT-preAD Study Group.",Database (Oxford),2021,2021,1758-0463,baab004,"im; research support, non-u.s. gov't; research-article; journal article",N,Y,N,Y,N,Y,0,Y,Y,N,Y,Y,2021-02-17,2021-02-01,NA,NA,journal article
1302,epmc|pmc,33916856,PMC8065670,10.3390/genes12040526,33916856,search,MED,Cancer Subtype Recognition Based on Laplacian Rank Constrained Multiview Clustering.,"Ge S, Wang X, Cheng Y, Liu J.",Genes (Basel),12,2021,2073-4425,526,"im; research support, non-u.s. gov't; research-article; journal article",Y,Y,N,Y,N,Y,1,Y,Y,N,N,N,2021-04-30,2021-04-03,4,NA,journal article
1303,epmc|pmc,34185510,PMC8760635,10.1021/acs.analchem.1c01948,34185510,search,MED,Chemoproteomic Approach toward Probing the Interactomes of Perfluoroalkyl Substances.,"Zhang Q, Dong X, Lu J, Song J, Wang Y.",Anal Chem,93,2021,0003-2700; 1520-6882;,9634-9639,"research-article; journal article; research support, n.i.h., extramural",N,Y,N,Y,N,Y,1,Y,Y,N,Y,N,2021-06-30,2021-06-29,27,NA,journal article
1305,epmc|pmc,34203322,PMC8269359,10.3390/ijms22136951,34203322,search,MED,"Simulated Microgravity Effects on Human Adenocarcinoma Alveolar Epithelial Cells: Characterization of Morphological, Functional, and Epigenetic Parameters.","Degan P, Cortese K, Pulliero A, Bruno S, Gagliani MC, Congiu M, Izzotti A.",Int J Mol Sci,22,2021,1422-0067,6951,im; research-article; journal article,Y,Y,N,Y,N,Y,2,Y,Y,N,Y,N,2021-07-03,2021-06-28,13,NA,journal article
1308,epmc|pmc,34820451,PMC8608537,10.1155/2021/3752871,34820451,search,MED,Downregulation of the Coiled-Coil Domain Containing 80 and Its Perspective Mechanisms in Ovarian Carcinoma: A Comprehensive Study.,"Liang ZQ, Gao L, Chen JH, Dai WB, Su YS, Chen G.",Int J Genomics,2021,2021,2314-436x; 2314-4378;,3752871,research-article; journal article,Y,Y,N,Y,N,Y,0,Y,Y,N,Y,Y,2021-12-01,2021-11-15,NA,NA,journal article
1310,epmc|pmc|pm,24809055,PMC3997997,10.1155/2014/594350,24809055,search,MED,Identification of microRNA as sepsis biomarker based on miRNAs regulatory network analysis.,"Huang J, Sun Z, Yan W, Zhu Y, Lin Y, Chen J, Shen B, Wang J.",Biomed Res Int,2014,2014,2314-6133; 2314-6141;,594350,"research support, non-u.s. gov't; research-article; journal article",Y,Y,Y,Y,N,Y,32,Y,Y,N,Y,Y,2014-05-09,2014-04-06,NA,NA,journal article
1312,epmc|pmc,33480849,PMC7864771,10.2196/24826,33480849,search,MED,"Mapping, Infrastructure, and Data Analysis for the Brazilian Network of Rare Diseases: Protocol for the RARASnet Observational Cohort Study.","Alves D, Yamada DB, Bernardi FA, Carvalho I, Filho MEC, Neiva MB, Lima VC, Félix TM.",JMIR Res Protoc,10,2021,1929-0748,e24826,research-article; journal article,Y,Y,N,N,N,N,1,Y,Y,N,N,N,2021-01-23,2021-01-22,1,NA,journal article
1314,epmc|pmc,32969779,PMC7792844,10.1152/japplphysiol.00168.2020,32969779,search,MED,Heat therapy: possible benefits for cognitive function and the aging brain.,"Von Schulze AT, Deng F, Morris JK, Geiger PC.",J Appl Physiol (1985),129,2020,8750-7587; 1522-1601;,1468-1476,"research support, non-u.s. gov't; review-article; review; journal article; research support, n.i.h., extramural",N,Y,N,N,N,N,0,Y,Y,N,Y,N,2020-09-25,2020-09-24,6,NA,journal article
1316,epmc|pmc|pm,36238572,PMC9553197,10.3389/fphar.2022.1001553,36238572,search,MED,Pharmacological effects and mechanisms of bee venom and its main components: Recent progress and perspective.,"Shi P, Xie S, Yang J, Zhang Y, Han S, Su S, Yao H.",Front Pharmacol,13,2022,1663-9812,1001553,review-article; review; journal article,Y,Y,N,Y,N,N,0,Y,Y,N,Y,N,2022-10-15,2022-09-27,NA,NA,journal article
1321,epmc|pmc,31885040,PMC7820841,10.1093/bib/bbz151,31885040,search,MED,Small noncoding RNA discovery and profiling with sRNAtools based on high-throughput sequencing.,"Liu Q, Ding C, Lang X, Guo G, Chen J, Su X.",Brief Bioinform,22,2021,1467-5463; 1477-4054;,463-473,"research support, non-u.s. gov't; research-article; journal article",Y,Y,N,Y,N,Y,13,Y,Y,Y,Y,Y,2020-01-01,2021-01-01,1,NA,journal article
1325,epmc|pmc,35965952,PMC9362348,10.1007/s42979-022-01298-4,35965952,search,MED,Semantic Integration of Heterogeneous Data Sources Using Ontology-Based Domain Knowledge Modeling for Early Detection of COVID-19.,"Thirumahal R, Sudha Sadasivam G, Shruti P.",SN Comput Sci,3,2022,2662-995x; 2661-8907;,428,research-article; journal article,Y,Y,N,Y,N,N,0,Y,Y,N,N,N,2022-08-16,2022-08-06,6,NA,journal article
1326,epmc|pmc,35071341,PMC8767007,10.3389/fcvm.2021.755321,35071341,search,MED,"Network-Based Approach and IVI Methodologies, a Combined Data Investigation Identified Probable Key Genes in Cardiovascular Disease and Chronic Kidney Disease.","Ahmed MM, Tazyeen S, Haque S, Sulimani A, Ali R, Sajad M, Alam A, Ali S, Bagabir HA, Bagabir RA, Ishrat R.",Front Cardiovasc Med,8,2021,2297-055x,755321,research-article; journal article,Y,Y,N,Y,N,Y,0,Y,Y,N,Y,Y,2022-01-25,2021-01-01,NA,NA,journal article
1327,epmc|pmc,30589856,PMC6320013,10.1371/journal.pone.0209611,30589856,search,MED,Genome-wide maps of distal gene regulatory enhancers active in the human placenta.,"Zhang J, Simonti CN, Capra JA.",PLoS One,13,2018,1932-6203,e0209611,"research support, non-u.s. gov't; research-article; journal article; research support, n.i.h., extramural",Y,Y,N,Y,N,Y,4,Y,Y,N,Y,N,2019-01-01,2018-12-27,12,NA,journal article
1328,epmc|pmc,32483629,PMC7647323,10.1093/jamia/ocaa066,32483629,search,MED,The My Cancer Genome clinical trial data model and trial curation workflow.,"Jain N, Mittendorf KF, Holt M, Lenoue-Newton M, Maurer I, Miller C, Stachowiak M, Botyrius M, Cole J, Micheel C, Levy M.",J Am Med Inform Assoc,27,2020,1067-5027; 1527-974x;,1057-1066,"research support, non-u.s. gov't; research-article; journal article; research support, n.i.h., extramural",Y,Y,N,Y,N,Y,5,Y,Y,N,Y,Y,2020-06-03,2020-07-01,7,NA,journal article
1331,epmc|pmc,28635598,PMC5612389,10.1016/s0140-6736(17)31615-x,28635598,search,MED,Sickle cell disease: tipping the balance of genomic research to catalyse discoveries in Africa.,"Makani J, Ofori-Acquah SF, Tluway F, Mulder N, Wonkam A.",Lancet,389,2017,0140-6736; 1474-547x;,2355-2358,research-article; journal article,N,Y,N,Y,N,N,7,Y,Y,N,Y,N,2017-06-21,2017-06-15,10087,NA,journal article
1332,epmc|pmc,35628451,PMC9144947,10.3390/ijms23105641,35628451,search,MED,Clinical and Genetic Characterization of Patients with Bartter and Gitelman Syndrome.,"Palazzo V, Raglianti V, Landini S, Cirillo L, Errichiello C, Buti E, Artuso R, Tiberi L, Vergani D, Dirupo E, Romagnani P, Mazzinghi B, Becherucci F.",Int J Mol Sci,23,2022,1422-0067,5641,research-article; journal article,Y,Y,N,Y,N,Y,0,Y,Y,N,Y,N,2022-05-28,2022-05-18,10,NA,journal article
1334,epmc|pmc,33980147,PMC8114493,10.1186/s12859-020-03868-w,33980147,search,MED,DSCMF: prediction of LncRNA-disease associations based on dual sparse collaborative matrix factorization.,"Liu JX, Gao MM, Cui Z, Gao YL, Li F.",BMC Bioinformatics,22,2021,1471-2105,241,research-article; journal article,Y,Y,N,Y,N,N,1,Y,Y,N,Y,Y,2021-05-14,2021-05-12,suppl 3,NA,journal article
1336,epmc|pmc,32073412,PMC9229554,10.1097/mol.0000000000000662,32073412,search,MED,Using the electronic health record for genomics research.,"Safarova MS, Kullo IJ.",Curr Opin Lipidol,31,2020,0957-9672; 1473-6535;,85-93,"research support, non-u.s. gov't; research-article; review; journal article; research support, n.i.h., extramural",N,Y,N,Y,N,N,3,Y,Y,N,Y,N,2020-02-20,2020-04-01,2,NA,journal article
1338,epmc|pmc,31592534,PMC6913230,10.1093/jamia/ocz169,31592534,search,MED,Using clinical reasoning ontologies to make smarter clinical decision support systems: a systematic review and data synthesis.,"Dissanayake PI, Colicchio TK, Cimino JJ.",J Am Med Inform Assoc,27,2020,1067-5027; 1527-974x;,159-174,"research support, non-u.s. gov't; systematic review; review-article; journal article; research support, n.i.h., extramural",Y,Y,N,Y,N,Y,9,Y,Y,N,Y,N,2019-10-09,2020-01-01,1,NA,journal article
1340,epmc|pmc,33910328,PMC8169330,10.30773/pi.2020.0410,33910328,search,MED,Transcriptome Sequencing Reveals the Potential Mechanisms of Modified Electroconvulsive Therapy in Schizophrenia.,"Peng W, Tan Q, Yu M, Wang P, Wang T, Yuan J, Liu D, Chen D, Huang C, Tan Y, Liu K, Xiang B, Liang X.",Psychiatry Investig,18,2021,1738-3684; 1976-3026;,385-391,research-article; journal article,Y,Y,N,Y,N,Y,0,Y,Y,N,Y,Y,2021-04-29,2021-04-29,5,NA,journal article
1341,epmc|pmc,28098235,PMC5241776,10.1038/srep39276,28098235,search,MED,Molecular Characterization of Pediatric Restrictive Cardiomyopathy from Integrative Genomics.,"Rindler TN, Hinton RB, Salomonis N, Ware SM.",Sci Rep,7,2017,2045-2322,39276,"research support, non-u.s. gov't; research-article; journal article; research support, n.i.h., extramural",Y,Y,N,Y,N,Y,11,Y,Y,N,Y,Y,2017-01-18,2017-01-18,NA,NA,journal article
1343,epmc|pmc,33561390,PMC7980222,10.1016/j.molcel.2021.01.011,33561390,search,MED,Neuronal non-CG methylation is an essential target for MeCP2 function.,"Tillotson R, Cholewa-Waclaw J, Chhatbar K, Connelly JC, Kirschner SA, Webb S, Koerner MV, Selfridge J, Kelly DA, De Sousa D, Brown K, Lyst MJ, Kriaucionis S, Bird A.",Mol Cell,81,2021,1097-2765; 1097-4164;,1260-1275.e12,"research support, non-u.s. gov't; research-article; journal article",Y,Y,N,N,N,Y,4,Y,Y,Y,Y,Y,2021-02-10,2021-02-08,6,NA,journal article
1345,epmc|pmc,30588240,PMC6299400,10.7150/jca.27655,30588240,search,MED,Systematic Analysis of Gene Expression Alteration and Co-Expression Network of Eukaryotic Initiation Factor 4A-3 in Cancer.,"Lin Y, Zhang J, Cai J, Liang R, Chen G, Qin G, Han X, Yuan C, Liu Z, Li Y, Zou D, Mao Y.",J Cancer,9,2018,1837-9664,4568-4577,research-article; journal article,Y,Y,N,Y,N,Y,17,Y,Y,N,Y,N,2019-01-01,2018-11-11,24,NA,journal article
1347,epmc|pmc,32802398,PMC7421993,10.2144/fsoa-2020-0015,32802398,search,MED,A new standardized data collection system for brain stereotactic external radiotherapy: the PRE.M.I.S.E project.,"Chiesa S, Tolu B, Longo S, Nardiello B, Capocchiano ND, Rea F, Capone L, Stimato G, Gatta R, Pacchiarotti A, Massaccesi M, Minniti G, Cellini F, Damiani A, Balducci M, Gentile P, Valentini V, Bianciardi F.",Future Sci OA,6,2020,2056-5623,FSO596,research-article; journal article,Y,Y,N,Y,N,N,1,Y,Y,N,Y,N,2020-08-18,2020-05-27,7,NA,journal article
1348,epmc|pmc,32590738,PMC7328939,10.1097/md.0000000000020635,32590738,search,MED,High expression of ghrelin and obestatin prepropeptide in tumor tissues predicted adverse overall survival in gastric carcinoma patients.,"Wu X, Wu Y, Ye B, Wu F, Wang P.",Medicine (Baltimore),99,2020,0304-5412; 1536-5964; 0025-7974;,e20635,research-article; journal article,Y,Y,N,Y,N,N,4,Y,Y,Y,Y,Y,2020-06-27,2020-06-01,26,NA,journal article
1349,epmc|pmc,33674350,PMC8015846,10.1101/gr.267898.120,33674350,search,MED,AP-1 subunits converge promiscuously at enhancers to potentiate transcription.,"Seo J, Koçak DD, Bartelt LC, Williams CA, Barrera A, Gersbach CA, Reddy TE.",Genome Res,31,2021,1088-9051; 1549-5469;,538-550,"research support, non-u.s. gov't; research-article; journal article; research support, n.i.h., extramural",N,Y,N,Y,N,Y,1,Y,Y,Y,Y,Y,2021-03-07,2021-03-05,4,NA,journal article
1350,epmc|pmc,25954574,PMC4419766,NA,25954574,search,MED,Ontology-based tools to expedite predictive model construction.,"Haug P, Holmen J, Wu X, Mynam K, Ebert M, Ferraro J.",AMIA Jt Summits Transl Sci Proc,2014,2014,2153-4063,32-36,research-article; journal article,Y,Y,N,Y,N,N,1,Y,Y,N,N,N,2015-05-09,2014-04-07,NA,NA,journal article
1354,epmc|pmc,34306156,PMC8279870,10.1155/2021/8634705,34306156,search,MED,Network Pharmacology-Based Mechanistic Investigation of Jinshui Huanxian Formula Acting on Idiopathic Pulmonary Fibrosis.,"Liu T, Xu P, Qi S, Ke S, Hu Q, Zhao P, Li J.",Evid Based Complement Alternat Med,2021,2021,1741-427x; 1741-4288;,8634705,research-article; journal article,Y,Y,N,Y,N,Y,0,Y,Y,N,Y,Y,2021-07-27,2021-07-07,NA,NA,journal article
1362,epmc|pmc,35055340,PMC8778877,10.3390/jpm12010025,35055340,search,MED,An Unsupervised Approach to Structuring and Analyzing Repetitive Semantic Structures in Free Text of Electronic Medical Records.,"Koshman V, Funkner A, Kovalchuk S.",J Pers Med,12,2022,2075-4426,25,research-article; journal article,Y,Y,N,Y,N,N,0,Y,Y,N,Y,N,2022-01-24,2022-01-01,1,NA,journal article
1363,epmc|pmc,35414039,PMC9004040,10.1186/s13023-022-02299-5,35414039,search,MED,The national economic burden of rare disease in the United States in 2019.,"Yang G, Cintina I, Pariser A, Oehrlein E, Sullivan J, Kennedy A.",Orphanet J Rare Dis,17,2022,1750-1172,163,"research support, non-u.s. gov't; research-article; journal article",Y,Y,N,Y,N,Y,0,Y,Y,N,Y,N,2022-04-14,2022-04-12,1,NA,journal article
1364,epmc|pmc,35844879,PMC9282671,10.3389/fpubh.2022.862432,35844879,search,MED,How Far Can Conversational Agents Contribute to IBD Patient Health Care-A Review of the Literature.,"Pernencar C, Saboia I, Dias JC.",Front Public Health,10,2022,2296-2565,862432,"research support, non-u.s. gov't; systematic review; systematic-review",Y,Y,N,Y,N,N,0,Y,Y,N,Y,N,2022-07-19,2022-06-30,NA,NA,other
1365,epmc|pmc,34882763,PMC8787428,10.1093/bib/bbab510,34882763,search,MED,PhosPiR: an automated phosphoproteomic pipeline in R.,"Hong Y, Flinkman D, Suomi T, Pietilä S, James P, Coffey E, Elo LL.",Brief Bioinform,23,2022,1467-5463; 1477-4054;,bbab510,"research support, non-u.s. gov't; research-article; journal article",Y,Y,N,Y,N,Y,0,Y,Y,N,Y,Y,2021-12-16,2022-01-01,1,NA,journal article
1370,epmc|pmc|pm,29588317,PMC6160370,10.1161/circulationaha.117.032291,29588317,search,MED,Spatiotemporal Multi-Omics Mapping Generates a Molecular Atlas of the Aortic Valve and Reveals Networks Driving Disease.,"Schlotter F, Halu A, Goto S, Blaser MC, Body SC, Lee LH, Higashi H, DeLaughter DM, Hutcheson JD, Vyas P, Pham T, Rogers MA, Sharma A, Seidman CE, Loscalzo J, Seidman JG, Aikawa M, Singh SA, Aikawa E.",Circulation,138,2018,0009-7322; 1524-4539;,377-393,"research-article; journal article; research support, n.i.h., extramural",N,Y,N,Y,N,Y,63,Y,Y,N,Y,N,2018-03-29,2018-07-01,4,NA,journal article
1372,epmc,NA,NA,10.1101/2020.04.15.20065425,PPR152363,search,PPR,A consideration of publication-derived immune-related associations in Coronavirus and related lung damaging diseases,"Geifman N, Whetton AD.",NA,NA,2020,NA,NA,preprint,N,N,N,N,N,Y,1,N,Y,N,Y,N,2020-04-20,2020-04-18,NA,NA,preprint
1375,epmc|pmc,30173820,PMC6128307,10.1016/j.ajhg.2018.08.003,30173820,search,MED,"PubCaseFinder: A Case-Report-Based, Phenotype-Driven Differential-Diagnosis System for Rare Diseases.","Fujiwara T, Yamamoto Y, Kim JD, Buske O, Takagi T.",Am J Hum Genet,103,2018,0002-9297; 1537-6605;,389-399,"research support, non-u.s. gov't; research-article; journal article",N,Y,N,Y,N,Y,10,Y,Y,N,Y,N,2018-09-03,2018-08-30,3,NA,journal article
1376,epmc|pmc,30864315,PMC6417822,NA,30864315,search,MED,Automatic Human-like Mining and Constructing Reliable Genetic Association Database with Deep Reinforcement Learning.,"Wang H, Liu X, Tao Y, Ye W, Jin Q, Cohen WW, Xing EP.",Pac Symp Biocomput,24,2019,2335-6928; 2335-6936;,112-123,"research-article; research support, u.s. gov't, non-p.h.s.; journal article; research support, n.i.h., extramural",Y,Y,N,Y,N,N,1,Y,Y,N,N,N,2019-03-14,2019-01-01,NA,NA,journal article
1377,epmc|pmc,30329098,PMC6323930,10.1093/nar/gky960,30329098,search,MED,LncBook: a curated knowledgebase of human long non-coding RNAs.,"Ma L, Cao J, Liu L, Du Q, Li Z, Zou D, Bajic VB, Zhang Z.",Nucleic Acids Res,47,2019,0305-1048; 1362-4962;,D128-D134,"research support, non-u.s. gov't; research-article; journal article",Y,Y,N,Y,N,N,63,Y,Y,N,Y,N,2018-10-18,2019-01-01,d1,NA,journal article
1378,epmc|pmc,29435496,PMC5801341,10.1128/msystems.00219-17,29435496,search,MED,Zika Virus Alters DNA Methylation of Neural Genes in an Organoid Model of the Developing Human Brain.,"Janssens S, Schotsaert M, Karnik R, Balasubramaniam V, Dejosez M, Meissner A, García-Sastre A, Zwaka TP.",mSystems,3,2018,2379-5077,e00219-17,research-article; journal article,Y,Y,N,Y,N,N,24,Y,Y,Y,Y,Y,2018-02-14,2018-01-01,1,NA,journal article
1380,epmc|pmc,34276764,PMC8281131,10.3389/fgene.2021.649619,34276764,search,MED,"Long Non-coding RNAs: Mechanisms, Experimental, and Computational Approaches in Identification, Characterization, and Their Biomarker Potential in Cancer.","Chowdhary A, Satagopam V, Schneider R.",Front Genet,12,2021,1664-8021,649619,review-article; review; journal article,Y,Y,N,Y,N,N,4,Y,Y,N,Y,N,2021-07-20,2021-07-01,NA,NA,journal article
1381,epmc|pmc,29218886,PMC5728662,NA,29218886,search,MED,ClinGen Cancer Somatic Working Group - standardizing and democratizing access to cancer molecular diagnostic data to drive translational research.,"Madhavan S, Ritter D, Micheel C, Rao S, Roy A, Sonkin D, Mccoy M, Griffith M, Griffith OL, Mcgarvey P, Kulkarni S.",Pac Symp Biocomput,23,2018,2335-6928; 2335-6936;,247-258,research-article; journal article,N,Y,N,Y,N,N,13,Y,Y,N,N,N,2017-12-09,2018-01-01,NA,NA,journal article
