id,src,pmid,pmcid,doi,epmc_id,from,source,title,authorString,journalTitle,journalVolume,pubYear,journalIssn,pageInfo,pubType,isOpenAccess,inEPMC,inPMC,hasPDF,hasBook,hasSuppl,citedByCount,hasReferences,hasTextMinedTerms,hasDbCrossReferences,hasLabsLinks,hasTMAccessionNumbers,firstIndexDate,firstPublicationDate,issue,versionNumber,pub_type
1945,epmc,34445667,PMC8396480,10.3390/ijms22168962,34445667,search,MED,Drug Discovery of Spinal Muscular Atrophy (SMA) from the Computational Perspective: A Comprehensive Review.,"Chong LC, Gandhi G, Lee JM, Yeo WWY, Choi SB.",Int J Mol Sci,22,2021,1422-0067,8962,im; review-article; review; journal article,Y,Y,N,Y,N,N,1,Y,Y,N,Y,Y,2021-08-28,2021-08-20,16,NA,journal article
1946,epmc|pmc,19091693,PMC7141777,10.1126/scisignal.150mr2,19091693,search,MED,Ontologies of cellular networks.,"Arp R, Smith B.",Sci Signal,1,2008,1945-0877; 1937-9145;,mr2,congress; research-article,N,Y,N,Y,N,N,1,Y,Y,N,Y,N,2009-01-23,2008-12-16,50,NA,meeting
1947,epmc|pmc,33555272,PMC7954605,10.1172/jci141566,33555272,search,MED,RUNX2 regulates leukemic cell metabolism and chemotaxis in high-risk T cell acute lymphoblastic leukemia.,"Matthijssens F, Sharma ND, Nysus M, Nickl CK, Kang H, Perez DR, Lintermans B, Van Loocke W, Roels J, Peirs S, Demoen L, Pieters T, Reunes L, Lammens T, De Moerloose B, Van Nieuwerburgh F, Deforce DL, Cheung LC, Kotecha RS, Risseeuw MD, Van Calenbergh S, Takarada T, Yoneda Y, van Delft FW, Lock RB, Merkley SD, Chigaev A, Sklar LA, Mullighan CG, Loh ML, Winter SS, Hunger SP, Goossens S, Castillo EF, Ornatowski W, Van Vlierberghe P, Matlawska-Wasowska K.",J Clin Invest,131,2021,0021-9738; 1558-8238;,141566,"im; research support, non-u.s. gov't; research-article; journal article; research support, n.i.h., extramural",N,Y,N,Y,N,Y,3,Y,Y,Y,Y,Y,2021-02-09,2021-03-01,6,NA,journal article
1948,epmc|pmc,33660061,PMC8113308,10.1007/s00204-021-03008-0,33660061,search,MED,Integration of transcriptome analysis with pathophysiological endpoints to evaluate cigarette smoke toxicity in an in vitro human airway tissue model.,"Xiong R, Wu Y, Wu Q, Muskhelishvili L, Davis K, Tripathi P, Chen Y, Chen T, Bryant M, Rosenfeldt H, Healy SM, Cao X.",Arch Toxicol,95,2021,0340-5761; 1432-0738;,1739-1761,"research-article; research support, u.s. gov't, non-p.h.s.; journal article",Y,Y,N,Y,N,Y,4,Y,Y,N,Y,N,2021-03-05,2021-03-03,5,NA,journal article
1949,epmc|pmc,29476864,PMC6087490,10.1016/j.taap.2018.02.014,29476864,search,MED,A systems biology approach to predictive developmental neurotoxicity of a larvicide used in the prevention of Zika virus transmission.,"Audouze K, Taboureau O, Grandjean P.",Toxicol Appl Pharmacol,354,2018,0041-008x; 1096-0333;,56-63,"research-article; journal article; research support, n.i.h., extramural",N,Y,N,Y,N,Y,4,Y,Y,N,Y,N,2018-02-25,2018-02-21,NA,NA,journal article
1951,epmc|pmc,24551360,PMC3900201,NA,24551360,search,MED,A family-based framework for supporting quality assurance of biomedical ontologies in BioPortal.,"He Z, Ochs C, Agrawal A, Perl Y, Zeginis D, Tarabanis K, Elhanan G, Halper M, Noy N, Geller J.",AMIA Annu Symp Proc,2013,2013,1942-597x,581-590,research-article; journal article,N,Y,Y,Y,N,N,7,Y,Y,N,N,N,2014-02-20,2013-11-16,NA,NA,journal article
1953,epmc|pmc,23794737,PMC3689439,10.1093/database/bat046,23794737,search,MED,Analysis of disease-associated objects at the Rat Genome Database.,"Wang SJ, Laulederkind SJ, Hayman GT, Smith JR, Petri V, Lowry TF, Nigam R, Dwinell MR, Worthey EA, Munzenmaier DH, Shimoyama M, Jacob HJ.",Database (Oxford),2013,2013,1758-0463,bat046,"research-article; journal article; research support, n.i.h., extramural",Y,Y,Y,Y,N,Y,7,Y,Y,N,Y,Y,2013-06-25,2013-06-21,NA,NA,journal article
1954,epmc|pmc,29648604,PMC7647029,10.1093/jamia/ocy021,29648604,search,MED,UMLS to DBPedia link discovery through circular resolution.,"Cuzzola J, Bagheri E, Jovanovic J.",J Am Med Inform Assoc,25,2018,1067-5027; 1527-974x;,819-826,"research support, non-u.s. gov't; research-article; journal article",N,Y,N,Y,N,Y,0,Y,Y,N,Y,N,2018-04-13,2018-07-01,7,NA,journal article
1955,epmc|pmc,29370821,PMC5785853,10.1186/s13023-018-0765-y,29370821,search,MED,PhenoDis: a comprehensive database for phenotypic characterization of rare cardiac diseases.,"Adler A, Kirchmeier P, Reinhard J, Brauner B, Dunger I, Fobo G, Frishman G, Montrone C, Mewes HW, Arnold M, Ruepp A.",Orphanet J Rare Dis,13,2018,1750-1172,22,"research support, non-u.s. gov't; research-article; journal article; research support, n.i.h., extramural",Y,Y,N,Y,N,N,4,Y,Y,N,N,N,2018-01-27,2018-01-25,1,NA,journal article
1956,epmc|pmc,29348552,PMC5773503,10.1038/s41598-018-19357-3,29348552,search,MED,TPGLDA: Novel prediction of associations between lncRNAs and diseases via lncRNA-disease-gene tripartite graph.,"Ding L, Wang M, Sun D, Li A.",Sci Rep,8,2018,2045-2322,1065,"research support, non-u.s. gov't; research-article; journal article",Y,Y,N,Y,N,Y,31,Y,Y,N,Y,N,2018-01-20,2018-01-18,1,NA,journal article
1959,epmc|pmc,34341784,PMC8328070,10.21203/rs.3.rs-673011/v1,PPR375227,search,PPR,"Impact of natural selection on global patterns of genetic variation, and association with clinical phenotypes, at genes involved in SARS-CoV-2 infection.","Zhang C, Verma A, Feng Y, Melo MCdR, McQuillan M, Hansen M, Lucas A, Park J, Ranciaro A, Thompson S, Rubel M, Campbell M, Beggs W, Hirbo J, Mpoloka SW, Mokone GG, Jones M, Nyambo T, Meskel DW, Belay G, Fokunang C, Njamnshi A, Omar S, Williams S, Rader D, Ritchie M, Fuente Cdl, Sirugo G, Tishkoff S.",NA,NA,2021,NA,NA,preprint,Y,Y,N,Y,N,Y,0,N,Y,N,N,Y,2021-07-28,2021-07-27,NA,1,preprint
1962,epmc|pmc,31127124,PMC6534545,10.1038/s41598-019-42178-x,31127124,search,MED,Exploratory Gene Ontology Analysis with Interactive Visualization.,"Zhu J, Zhao Q, Katsevich E, Sabatti C.",Sci Rep,9,2019,2045-2322,7793,"research support, non-u.s. gov't; research-article; research support, u.s. gov't, non-p.h.s.; journal article",Y,Y,N,Y,N,Y,6,Y,Y,N,Y,Y,2019-05-26,2019-05-24,1,NA,journal article
1963,epmc|pmc,33772537,PMC8120135,10.1093/hmg/ddab081,33772537,search,MED,Transgenic mice with an R342X mutation in Phf6 display clinical features of Börjeson-Forssman-Lehmann Syndrome.,"Ahmed R, Sarwar S, Hu J, Cardin V, Qiu LR, Zapata G, Vandeleur L, Yan K, Lerch JP, Corbett MA, Gecz J, Picketts DJ.",Hum Mol Genet,30,2021,0964-6906; 1460-2083;,575-594,"research support, non-u.s. gov't; research-article; journal article",N,Y,N,Y,N,Y,0,Y,Y,Y,Y,Y,2021-03-28,2021-05-01,7,NA,journal article
1964,epmc|pmc,31572428,PMC6749816,10.3389/fgene.2019.00769,31572428,search,MED,Inferring Latent Disease-lncRNA Associations by Faster Matrix Completion on a Heterogeneous Network.,"Li W, Wang S, Xu J, Mao G, Tian G, Yang J.",Front Genet,10,2019,1664-8021,769,research-article; journal article,Y,Y,N,Y,N,Y,5,Y,Y,N,Y,N,2019-10-05,2019-09-04,NA,NA,journal article
1967,epmc|pmc,32559196,PMC7304910,10.1371/journal.pone.0232654,32559196,search,MED,"Comprehensive genetic analysis of 961 unrelated Duchenne Muscular Dystrophy patients: Focus on diagnosis, prevention and therapeutic possibilities.","Kumar SH, Athimoolam K, Suraj M, Das Christu Das MS, Muralidharan A, Jeyam D, Ashokan J, Karthikeyan P, Krishna R, Khanna-Gupta A, Bremadesam Raman L.",PLoS One,15,2020,1932-6203,e0232654,research-article; journal article,Y,Y,N,Y,N,Y,2,Y,Y,N,Y,Y,2020-06-20,2020-06-19,6,NA,journal article
1968,epmc|pmc,33870041,PMC8028387,10.3389/frma.2020.00003,33870041,search,MED,Ontology-Based Graphs of Research Communities: A Tool for Understanding Threat Reduction Networks.,"Ambrosiano J, Sims B, Bartlow AW, Rosenberger W, Ressler M, Fair JM.",Front Res Metr Anal,5,2020,2504-0537,3,research-article; journal article,Y,Y,N,Y,N,N,3,Y,Y,N,Y,N,2021-04-20,2020-06-09,NA,NA,journal article
1971,epmc|pmc,29504919,PMC5836833,10.1186/s12920-018-0330-5,29504919,search,MED,Computational master-regulator search reveals mTOR and PI3K pathways responsible for low sensitivity of NCI-H292 and A427 lung cancer cell lines to cytotoxic action of p53 activator Nutlin-3.,"Boyarskikh U, Pintus S, Mandrik N, Stelmashenko D, Kiselev I, Evshin I, Sharipov R, Stegmaier P, Kolpakov F, Filipenko M, Kel A.",BMC Med Genomics,11,2018,1755-8794,12,"research support, non-u.s. gov't; research-article; journal article",Y,Y,N,Y,N,Y,1,Y,Y,N,Y,Y,2018-03-05,2018-02-13,suppl 1,NA,journal article
1972,epmc|pmc,25668218,PMC4323218,10.1371/journal.pcbi.1004048,25668218,search,MED,Developing a molecular roadmap of drug-food interactions.,"Jensen K, Ni Y, Panagiotou G, Kouskoumvekaki I.",PLoS Comput Biol,11,2015,1553-734x; 1553-7358;,e1004048,research-article; journal article,Y,Y,N,Y,N,Y,14,Y,Y,N,Y,Y,2015-02-11,2015-02-10,2,NA,journal article
1973,epmc|pmc,34230933,PMC8259910,10.1101/2021.06.28.21259529,PPR364382,search,PPR,"Impact of natural selection on global patterns of genetic variation, and association with clinical phenotypes, at genes involved in SARS-CoV-2 infection","Zhang C, Verma A, Feng Y, Melo MCR, McQuillan M, Hansen M, Lucas A, Park J, Ranciaro A, Thompson S, Rubel MA, Campbell MC, Beggs W, Hirbo J, Mpoloka SW, Mokone GG, Nyambo T, Meskel DW, Belay G, Fokunang C, Njamnshi AK, Omar SA, Williams SM, Rader D, Ritchie MD, de la Fuente Nunez C, Sirugo G, Tishkoff S, Regeneron Genetic Center.",NA,NA,2021,NA,NA,preprint,Y,Y,N,Y,N,Y,0,N,Y,N,N,Y,2021-07-03,2021-07-01,NA,NA,preprint
1976,epmc|pmc,30580566,PMC6309981,10.1161/atvbaha.118.311928,30580566,search,MED,Proteins Altered by Surgical Weight Loss Highlight Biomarkers of Insulin Resistance in the Community.,"Shah RV, Hwang SJ, Yeri A, Tanriverdi K, Pico AR, Yao C, Murthy V, Ho J, Vitseva O, Demarco D, Shah S, Iafrati MD, Levy D, Freedman JE.",Arterioscler Thromb Vasc Biol,39,2019,1079-5642; 1524-4636;,107-115,"research support, n.i.h., intramural; research-article; journal article; research support, n.i.h., extramural",N,Y,N,Y,N,Y,11,Y,Y,N,Y,Y,2018-12-31,2019-01-01,1,NA,journal article
1977,epmc|pmc,34205793,PMC8234801,10.3390/s21124249,34205793,search,MED,"Intelligent Sensing Technologies for the Diagnosis, Monitoring and Therapy of Alzheimer's Disease: A Systematic Review.","Gillani N, Arslan T.",Sensors (Basel),21,2021,1424-8220,4249,im; systematic review; review-article; review; journal article,Y,Y,N,Y,N,N,0,Y,Y,N,Y,N,2021-07-03,2021-06-21,12,NA,journal article
1978,epmc|pmc,31350405,PMC6659642,10.1038/s41467-019-11026-x,31350405,search,MED,A machine-compiled database of genome-wide association studies.,"Kuleshov V, Ding J, Vo C, Hancock B, Ratner A, Li Y, Ré C, Batzoglou S, Snyder M.",Nat Commun,10,2019,2041-1723,3341,"research support, non-u.s. gov't; research-article; research support, u.s. gov't, non-p.h.s.; journal article; research support, n.i.h., extramural",Y,Y,N,Y,N,Y,5,Y,Y,N,Y,Y,2019-07-31,2019-07-26,1,NA,journal article
1979,epmc|pmc,30586318,PMC6510541,10.1056/nejmoa1806891,30586318,search,MED,Diagnostic Utility of Exome Sequencing for Kidney Disease.,"Groopman EE, Marasa M, Cameron-Christie S, Petrovski S, Aggarwal VS, Milo-Rasouly H, Li Y, Zhang J, Nestor J, Krithivasan P, Lam WY, Mitrotti A, Piva S, Kil BH, Chatterjee D, Reingold R, Bradbury D, DiVecchia M, Snyder H, Mu X, Mehl K, Balderes O, Fasel DA, Weng C, Radhakrishnan J, Canetta P, Appel GB, Bomback AS, Ahn W, Uy NS, Alam S, Cohen DJ, Crew RJ, Dube GK, Rao MK, Kamalakaran S, Copeland B, Ren Z, Bridgers J, Malone CD, Mebane CM, Dagaonkar N, Fellström BC, Haefliger C, Mohan S, Sanna-Cherchi S, Kiryluk K, Fleckner J, March R, Platt A, Goldstein DB, Gharavi AG.",N Engl J Med,380,2019,0028-4793; 1533-4406;,142-151,"research support, non-u.s. gov't; research-article; journal article; research support, n.i.h., extramural",N,Y,N,Y,N,Y,135,Y,Y,N,Y,N,2019-01-01,2018-12-26,2,NA,journal article
1982,epmc|pmc,31869322,PMC6946175,10.1371/journal.pcbi.1007541,31869322,search,MED,Overlap matrix completion for predicting drug-associated indications.,"Yang M, Luo H, Li Y, Wu FX, Wang J.",PLoS Comput Biol,15,2019,1553-734x; 1553-7358;,e1007541,"research support, non-u.s. gov't; research-article; journal article",Y,Y,N,Y,N,Y,5,Y,Y,N,Y,Y,2019-12-30,2019-12-23,12,NA,journal article
1983,epmc|pmc|pm,21544172,PMC3082863,10.6026/97320630006086,21544172,search,MED,On experiences of i2b2 (Informatics for integrating biology and the bedside) database with Japanese clinical patients' data.,"Takai-Igarashi T, Akasaka R, Suzuki K, Furukawa T, Yoshida M, Inoue K, Maruyama T, Maejima T, Bando M, Takasaki M, Sakota M, Eguchi M, Konagaya A, Matsuura H, Suzumura T, Tanaka H.",Bioinformation,6,2011,0973-2063,86-90,research-article; journal article,Y,Y,N,Y,N,Y,8,Y,Y,N,Y,N,2011-05-06,2011-03-26,2,NA,journal article
1985,epmc|pmc,26379229,PMC4718734,10.1038/nprot.2015.105,26379229,search,MED,Genomic variant annotation and prioritization with ANNOVAR and wANNOVAR.,"Yang H, Wang K.",Nat Protoc,10,2015,1754-2189; 1750-2799;,1556-1566,"research-article; journal article; research support, n.i.h., extramural",N,Y,N,Y,N,Y,328,Y,Y,N,Y,N,2015-09-18,2015-09-17,10,NA,journal article
1986,epmc|pmc,30321381,PMC6289551,10.1093/jamia/ocy123,30321381,search,MED,Project Tycho 2.0: a repository to improve the integration and reuse of data for global population health.,"van Panhuis WG, Cross A, Burke DS.",J Am Med Inform Assoc,25,2018,1067-5027; 1527-974x;,1608-1617,"research support, non-u.s. gov't; research-article; journal article; research support, n.i.h., extramural",Y,Y,N,Y,N,Y,0,Y,Y,N,Y,Y,2018-10-16,2018-12-01,12,NA,journal article
1987,epmc|pmc,34075210,PMC8440686,10.1038/s41431-021-00852-7,34075210,search,MED,Solving patients with rare diseases through programmatic reanalysis of genome-phenome data.,"Matalonga L, Hernández-Ferrer C, Piscia D, Solve-RD SNV-indel working group, Schüle R, Synofzik M, Töpf A, Vissers LELM, de Voer R, Solve-RD DITF-GENTURIS, Solve-RD DITF-ITHACA, Solve-RD DITF-euroNMD, Solve-RD DITF-RND, Tonda R, Laurie S, Fernandez-Callejo M, Picó D, Garcia-Linares C, Papakonstantinou A, Corvó A, Joshi R, Diez H, Gut I, Hoischen A, Graessner H, Beltran S, Solve-RD Consortia.",Eur J Hum Genet,29,2021,1018-4813; 1476-5438;,1337-1347,"research support, non-u.s. gov't; research-article; journal article",Y,Y,N,Y,N,Y,3,Y,Y,N,Y,N,2021-06-03,2021-06-01,9,NA,journal article
1990,epmc|pmc,24139526,PMC4016320,10.1186/1472-6807-13-24,24139526,search,MED,Quantification of the impact of PSI:Biology according to the annotations of the determined structures.,"DePietro PJ, Julfayev ES, McLaughlin WA.",BMC Struct Biol,13,2013,1472-6807,24,"research-article; journal article; research support, n.i.h., extramural",Y,Y,Y,Y,N,Y,0,Y,Y,N,Y,N,2013-10-22,2013-10-21,NA,NA,journal article
1991,epmc|pmc,29128334,PMC5746455,10.1016/j.cels.2017.10.010,29128334,search,MED,A Map of Human Mitochondrial Protein Interactions Linked to Neurodegeneration Reveals New Mechanisms of Redox Homeostasis and NF-κB Signaling.,"Malty RH, Aoki H, Kumar A, Phanse S, Amin S, Zhang Q, Minic Z, Goebels F, Musso G, Wu Z, Abou-Tok H, Meyer M, Deineko V, Kassir S, Sidhu V, Jessulat M, Scott NE, Xiong X, Vlasblom J, Prasad B, Foster LJ, Alberio T, Garavaglia B, Yu H, Bader GD, Nakamura K, Parkinson J, Babu M.",Cell Syst,5,2017,2405-4712; 2405-4720;,564-577.e12,"research support, non-u.s. gov't; research-article; journal article; research support, n.i.h., extramural",N,Y,N,Y,N,Y,19,Y,Y,Y,Y,Y,2017-11-13,2017-11-08,6,NA,journal article
1992,epmc|pmc,31761677,PMC6915843,10.1016/j.stemcr.2019.10.013,31761677,search,MED,SOX21 Ensures Rostral Forebrain Identity by Suppression of WNT8B during Neural Regionalization of Human Embryonic Stem Cells.,"Fang Z, Liu X, Wen J, Tang F, Zhou Y, Jing N, Jin Y.",Stem Cell Reports,13,2019,2213-6711,1038-1052,"research support, non-u.s. gov't; research-article; journal article",Y,Y,N,Y,N,Y,4,Y,Y,Y,Y,N,2019-11-26,2019-11-21,6,NA,journal article
1994,epmc|pmc,24772427,PMC3977459,10.1155/2014/527029,24772427,search,MED,Survey of network-based approaches to research of cardiovascular diseases.,"Sarajlić A, Pržulj N.",Biomed Res Int,2014,2014,2314-6133; 2314-6141;,527029,"research support, non-u.s. gov't; research-article; review; journal article",Y,Y,Y,Y,N,N,1,Y,Y,N,N,N,2014-04-29,2014-03-20,NA,NA,journal article
1995,epmc|pmc,22195180,PMC3243207,NA,22195180,search,MED,MiDas: automatic extraction of a common domain of discourse in sleep medicine for multi-center data integration.,"Sahoo SS, Ogbuji C, Luo L, Dong X, Cui L, Redline SS, Zhang GQ.",AMIA Annu Symp Proc,2011,2011,1942-597x,1196-1205,"research support, non-u.s. gov't; research-article; journal article; research support, n.i.h., extramural",N,Y,Y,Y,N,N,2,Y,Y,N,N,N,2012-01-02,2011-10-22,NA,NA,journal article
1996,epmc|pmc,32276639,PMC7149918,10.1186/s12974-020-01781-w,32276639,search,MED,Transcriptomic analysis of brain tissues identifies a role for CCAAT enhancer binding protein β in HIV-associated neurocognitive disorder.,"Canchi S, Swinton MK, Rissman RA, Fields JA.",J Neuroinflammation,17,2020,1742-2094,112,research-article; journal article,Y,Y,N,Y,N,Y,4,Y,Y,Y,Y,N,2020-04-12,2020-04-11,1,NA,journal article
1997,epmc,26656951,PMC4702926,10.1093/nar/gkv1329,26656951,search,MED,GeneWeaver: data driven alignment of cross-species genomics in biology and disease.,"Baker E, Bubier JA, Reynolds T, Langston MA, Chesler EJ.",Nucleic Acids Res,44,2016,0305-1048; 1362-4962;,D555-9,"research-article; journal article; research support, n.i.h., extramural",Y,Y,N,Y,N,N,14,Y,Y,N,Y,N,2015-12-22,2015-12-09,d1,NA,journal article
1998,epmc|pmc,23354682,PMC3825015,10.1007/s11357-013-9510-6,23354682,search,MED,Redefining meaningful age groups in the context of disease.,"Geifman N, Cohen R, Rubin E.",Age (Dordr),35,2013,0161-9152; 1574-4647;,2357-2366,"research support, non-u.s. gov't; research-article; journal article",N,Y,N,Y,N,N,14,Y,Y,N,Y,N,2013-01-29,2013-01-27,6,NA,journal article
1999,epmc|pmc,26989145,PMC4795931,10.1093/database/baw009,26989145,search,MED,An integrative data analysis platform for gene set analysis and knowledge discovery in a data warehouse framework.,"Chen YA, Tripathi LP, Mizuguchi K.",Database (Oxford),2016,2016,1758-0463,baw009,"im; research support, non-u.s. gov't; research-article; journal article",Y,Y,N,Y,N,Y,17,Y,Y,N,Y,N,2016-03-19,2016-03-17,NA,NA,journal article
2000,epmc|pmc,19956751,PMC2775909,10.1371/journal.pcbi.1000582,19956751,search,MED,"The rat genome database curators: who, what, where, why.","Shimoyama M, Hayman GT, Laulederkind SJ, Nigam R, Lowry TF, Petri V, Smith JR, Wang SJ, Munzenmaier DH, Dwinell MR, Twigger SN, Jacob HJ, RGD Team.",PLoS Comput Biol,5,2009,1553-734x; 1553-7358;,e1000582,"discussion; journal article; research support, n.i.h., extramural",Y,Y,Y,Y,N,N,13,Y,Y,N,Y,N,2010-09-29,2009-11-26,11,NA,journal article
2001,epmc|pmc,25131635,PMC4133978,10.1109/bibm.2013.6732517,25131635,search,MED,Text Mining Driven Drug-Drug Interaction Detection.,"Yan S, Jiang X, Chen Y.",Proceedings (IEEE Int Conf Bioinformatics Biomed),NA,2013,2156-1125,349-355,research-article; journal article,N,Y,Y,Y,N,N,6,Y,Y,N,N,N,2014-08-19,2013-01-01,NA,NA,journal article
2002,epmc|pmc,17151068,PMC1761441,10.1093/nar/gkl988,17151068,search,MED,"The Rat Genome Database, update 2007--easing the path from disease to data and back again.","Twigger SN, Shimoyama M, Bromberg S, Kwitek AE, Jacob HJ, RGD Team.",Nucleic Acids Res,35,2007,0305-1048; 1362-4962;,D658-62,"research-article; journal article; research support, n.i.h., extramural",Y,Y,N,Y,N,N,90,Y,Y,N,Y,N,2009-12-24,2006-12-06,database issue,NA,journal article
2003,epmc|pmc,26966091,PMC4968346,10.1182/blood-2015-08-664649,26966091,search,MED,Integrated genomic DNA/RNA profiling of hematologic malignancies in the clinical setting.,"He J, Abdel-Wahab O, Nahas MK, Wang K, Rampal RK, Intlekofer AM, Patel J, Krivstov A, Frampton GM, Young LE, Zhong S, Bailey M, White JR, Roels S, Deffenbaugh J, Fichtenholtz A, Brennan T, Rosenzweig M, Pelak K, Knapp KM, Brennan KW, Donahue AL, Young G, Garcia L, Beckstrom ST, Zhao M, White E, Banning V, Buell J, Iwanik K, Ross JS, Morosini D, Younes A, Hanash AM, Paietta E, Roberts K, Mullighan C, Dogan A, Armstrong SA, Mughal T, Vergilio JA, Labrecque E, Erlich R, Vietz C, Yelensky R, Stephens PJ, Miller VA, van den Brink MR, Otto GA, Lipson D, Levine RL.",Blood,127,2016,0006-4971; 1528-0020;,3004-3014,research-article; evaluation study; journal article,N,Y,N,N,N,N,121,Y,Y,N,Y,N,2016-03-12,2016-03-10,24,NA,journal article
2004,epmc|pmc,26963104,PMC4786343,10.1371/journal.pcbi.1004747,26963104,search,MED,Understanding Genotype-Phenotype Effects in Cancer via Network Approaches.,"Kim YA, Cho DY, Przytycka TM.",PLoS Comput Biol,12,2016,1553-734x; 1553-7358;,e1004747,"other; research support, n.i.h., intramural; review; journal article",Y,Y,N,Y,N,N,17,Y,Y,N,Y,N,2016-03-11,2016-03-10,3,NA,journal article
2009,epmc|pmc,31023338,PMC6485071,10.1186/s13059-019-1679-2,31023338,search,MED,African evolutionary history inferred from whole genome sequence data of 44 indigenous African populations.,"Fan S, Kelly DE, Beltrame MH, Hansen MEB, Mallick S, Ranciaro A, Hirbo J, Thompson S, Beggs W, Nyambo T, Omar SA, Meskel DW, Belay G, Froment A, Patterson N, Reich D, Tishkoff SA.",Genome Biol,20,2019,1474-7596; 1474-760x;,82,"comparative study; research support, non-u.s. gov't; research-article; research support, u.s. gov't, non-p.h.s.; journal article; research support, n.i.h., extramural",Y,Y,N,Y,N,Y,34,Y,Y,Y,Y,Y,2019-04-27,2019-04-26,1,NA,journal article
2013,epmc|pmc,26605116,PMC4629306,10.4103/2153-3539.166012,26605116,search,MED,Support patient search on pathology reports with interactive online learning based data extraction.,"Zheng S, Lu JJ, Appin C, Brat D, Wang F.",J Pathol Inform,6,2015,2229-5089; 2153-3539;,51,research-article; journal article,Y,Y,N,N,N,N,4,Y,Y,N,N,N,2015-11-26,2015-09-28,NA,NA,journal article
2017,epmc|pmc,30898118,PMC6427854,10.1186/s13023-019-1040-6,30898118,search,MED,Can a decision support system accelerate rare disease diagnosis? Evaluating the potential impact of Ada DX in a retrospective study.,"Ronicke S, Hirsch MC, Türk E, Larionov K, Tientcheu D, Wagner AD.",Orphanet J Rare Dis,14,2019,1750-1172,69,"research support, non-u.s. gov't; research-article; journal article",Y,Y,N,Y,N,Y,30,Y,Y,N,Y,N,2019-03-23,2019-03-21,1,NA,journal article
2018,epmc|pmc,33032576,PMC7542735,10.1186/s12911-020-01273-0,33032576,search,MED,A realism-based approach to an ontological representation of symbiotic interactions.,"Diller M, Johnson E, Hicks A, Hogan WR.",BMC Med Inform Decis Mak,20,2020,1472-6947,258,"research-article; journal article; research support, n.i.h., extramural",Y,Y,N,Y,N,N,0,Y,Y,N,Y,Y,2020-10-16,2020-10-08,1,NA,journal article
2019,epmc|pmc,28672924,PMC5488641,10.3892/etm.2017.4500,28672924,search,MED,Plasma proteins as potential targets of abnormal Savda syndrome in asthma patients treated with unique Uighur prescription.,"Zhang C, Abudula A, Awuti M, Wang H, Aihemaiti X, Tusung T, Sulaiman X, Upur H.",Exp Ther Med,14,2017,1792-0981; 1792-1015;,267-275,research-article; journal article,Y,Y,N,Y,N,N,1,Y,Y,N,Y,Y,2017-07-04,2017-05-23,1,NA,journal article
2020,epmc|pmc,28587637,PMC5461726,10.1186/s13326-017-0131-3,28587637,search,MED,Literature evidence in open targets - a target validation platform.,"Kafkas Ş, Dunham I, McEntyre J.",J Biomed Semantics,8,2017,2041-1480,20,research-article; journal article,Y,Y,N,Y,N,N,4,Y,Y,N,Y,Y,2017-06-08,2017-06-06,1,NA,journal article
2021,epmc|pmc,35679235,PMC9182266,10.1371/journal.pone.0269687,35679235,search,MED,Covid19/IT the digital side of Covid19: A picture from Italy with clustering and taxonomy.,"Bonnici V, Cicceri G, Distefano S, Galletta L, Polignano M, Scaffidi C.",PLoS One,17,2022,1932-6203,e0269687,research-article; journal article,Y,Y,N,Y,N,N,0,Y,N,N,Y,N,2022-06-10,2022-06-09,6,NA,journal article
2023,epmc|pmc,25805135,PMC4456036,10.1016/j.devcel.2015.01.028,25805135,search,MED,A LncRNA-MAF:MAFB transcription factor network regulates epidermal differentiation.,"Lopez-Pajares V, Qu K, Zhang J, Webster DE, Barajas BC, Siprashvili Z, Zarnegar BJ, Boxer LD, Rios EJ, Tao S, Kretz M, Khavari PA.",Dev Cell,32,2015,1534-5807; 1878-1551;,693-706,"research-article; research support, u.s. gov't, non-p.h.s.; journal article; research support, n.i.h., extramural",N,Y,N,Y,N,Y,90,Y,Y,Y,Y,Y,2015-03-26,2015-03-01,6,NA,journal article
2026,epmc|pmc,26521025,PMC4628784,10.1186/s13073-015-0230-7,26521025,search,MED,Transcriptome sequencing reveals thousands of novel long non-coding RNAs in B cell lymphoma.,"Verma A, Jiang Y, Du W, Fairchild L, Melnick A, Elemento O.",Genome Med,7,2015,1756-994x,110,research-article; journal article,Y,Y,N,Y,N,N,37,Y,Y,Y,Y,Y,2015-11-02,2015-11-01,NA,NA,journal article
2027,epmc|pmc,22135296,PMC3245112,10.1093/nar/gkr1089,22135296,search,MED,VectorBase: improvements to a bioinformatics resource for invertebrate vector genomics.,"Megy K, Emrich SJ, Lawson D, Campbell D, Dialynas E, Hughes DS, Koscielny G, Louis C, Maccallum RM, Redmond SN, Sheehan A, Topalis P, Wilson D, VectorBase Consortium.",Nucleic Acids Res,40,2012,0305-1048; 1362-4962;,D729-34,"research support, non-u.s. gov't; research-article; journal article; research support, n.i.h., extramural",Y,Y,Y,Y,N,N,110,Y,Y,N,Y,N,2011-12-03,2011-12-01,database issue,NA,journal article
2028,epmc|pmc|pm,21901084,PMC3161904,10.1371/journal.pcbi.1002141,21901084,search,MED,Using electronic patient records to discover disease correlations and stratify patient cohorts.,"Roque FS, Jensen PB, Schmock H, Dalgaard M, Andreatta M, Hansen T, Søeby K, Bredkjær S, Juul A, Werge T, Jensen LJ, Brunak S.",PLoS Comput Biol,7,2011,1553-734x; 1553-7358;,e1002141,"research support, non-u.s. gov't; research-article; journal article",Y,Y,Y,Y,N,Y,123,Y,Y,N,Y,N,2011-09-09,2011-08-25,8,NA,journal article
